text,comment_category,final_subjectivity_label,aspect_input,pipeline,roberta_sentiment,roberta_confidence,deberta_base_sentiment,deberta_base_confidence,deberta_base_finetuned_sentiment,deberta_base_finetuned_confidence,deberta_large_sentiment,deberta_large_confidence,deberta_models_agree,final_base_sentiment,final_base_confidence,final_finetuned_sentiment,final_finetuned_confidence,final_large_sentiment,final_large_confidence
I have the xiaomi 15 ultra currently in hands and the curve edges are super fine. They are not so curvy but not so flat its almost perfect for me. It also makes the gestures very smooth and you actually know when you are going to do them cause they need to be pushed from the bent screen area,overall,Subjective,overall,overall,positive,0.9429,N/A,,N/A,,N/A,,,positive,0.9429,positive,0.9429,positive,0.9429
"No... a lot of it is nonsensical. They most likely paid Leica to use their logo... apart from the camera - the rest of the phone is behind the main competition. Maybe - they will catch up soon enough. Another point worth noting: Xiaomi use Samsung technology in its camera sensors, something else they fail to mention. I will need a lot more convincing to part with my hard-earned money. If you are expecting medium format quality with this phone... you'll be greatly disappointed.",overall,Subjective,overall,overall,negative,0.7728,N/A,,N/A,,N/A,,,negative,0.7728,negative,0.7728,negative,0.7728
Vivo X 200 ultra Vs xiaomi 15 ultra camera review venam ullavar like cheyu😊,overall,Subjective,overall,overall,neutral,0.5002,N/A,,N/A,,N/A,,,neutral,0.5002,neutral,0.5002,neutral,0.5002
so which phone should I get. The samsung s25 ultra or the xiaomi 15 ultra,overall,Subjective,overall,overall,neutral,0.856,N/A,,N/A,,N/A,,,neutral,0.856,neutral,0.856,neutral,0.856
"Vivo x200 pro can take portrait of moving subjects, which speak volume of its dedicated V3+ chip. On the other hands, Xiaomi processing has improved significantly and zoom is much better and more realistic than x200 pro. Let's see how Vivo X200U will fare this year against Xiaomi 15U.",overall,Subjective,overall,overall,positive,0.8902,N/A,,N/A,,N/A,,,positive,0.8902,positive,0.8902,positive,0.8902
"Before i sort of expected Xiaomi to sell its phones cheaper than Samsung, and iPhone. But then i realized that Xiaomi had to actually buy so many of its parts from others.",overall,Subjective,overall,overall,neutral,0.6891,N/A,,N/A,,N/A,,,neutral,0.6891,neutral,0.6891,neutral,0.6891
Love the look of this phone! Been meaning to upgrade my S23 Ultra. Was looking at the Oppo Find X8 Pro but I'm not a fannof the screen and lack of accesoires. Too bad the optical zoom only goes to 4.3x though. Wish it would be at least 6x like the Oppo. Giving up the optical 10x on the S23 Ultra will suck.,overall,Subjective,overall,overall,positive,0.7723,N/A,,N/A,,N/A,,,positive,0.7723,positive,0.7723,positive,0.7723
"In Spain the promo was sick, Xiaomi 15 ultra + Xiaomi Pad 7, Photography kit for 36 Euros, 120w Charger for 9 Eur, Redmi buds for 9 too, All for 1340 Euros, there is a active discount of 200 Euros, plus they take my Iphone 12 for 300 Euros.",overall,Subjective,overall,overall,positive,0.8428,N/A,,N/A,,N/A,,,positive,0.8428,positive,0.8428,positive,0.8428
Bro xiaomi 15 ultra aano atho vivo x200 ultra aanu best,overall,Subjective,overall,overall,positive,0.6354,N/A,,N/A,,N/A,,,positive,0.6354,positive,0.6354,positive,0.6354
Xiaomi 15 ultra honor magic 7pro Which of these is better?,overall,Subjective,overall,overall,positive,0.502,N/A,,N/A,,N/A,,,positive,0.502,positive,0.502,positive,0.502
Xiaomi 15 ultra or vivo x200 pro ultra?! Which one is better,overall,Subjective,overall,overall,positive,0.5174,N/A,,N/A,,N/A,,,positive,0.5174,positive,0.5174,positive,0.5174
Camera is amazing on these phones but hope the camera doesn't fog up like it did last year on 14 ultra plus camera killed the battery,overall,Subjective,overall,overall,positive,0.5955,N/A,,N/A,,N/A,,,positive,0.5955,positive,0.5955,positive,0.5955
"Ngl my biggest problem with xiamoi phones is the overheating and aber time it gets slow over genreal use ,gaming etc. but over all i love where Xiaomi is headed with theirastes model ngl",overall,Subjective,overall,overall,negative,0.3856,N/A,,N/A,,N/A,,,negative,0.3856,negative,0.3856,negative,0.3856
"Jermaine, I love your work! Really appreciate the effort you put in. I’m curious, with all the previous Xiaomi products, have you noticed whether Xiaomi has made an effort to fix issues with their past phones? Especially camera updates?",overall,Subjective,overall,overall,positive,0.9385,N/A,,N/A,,N/A,,,positive,0.9385,positive,0.9385,positive,0.9385
I'm considering to buy it but the struggling on moving object is bothering me.. is it a deal breaker for you ? The video stabilisation is also a problem.. I've also seen the s25 ultra has issue with moving subject. Wich Phone would you recommend? I've a s22 ultra for now. Thx,overall,Subjective,overall,overall,negative,0.7534,N/A,,N/A,,N/A,,,negative,0.7534,negative,0.7534,negative,0.7534
"@lorenzobrogi6359 nope, it’s their problem because any person with half a brain will look at this Xiaomi and go: if I’m expected to drop this much money for a phone, I’d rather go with something that offers better customer service, longer software support and has a better resale value. My personal experience with Xiaomi keeps me the hell away from them.",overall,Subjective,overall,overall,negative,0.7575,N/A,,N/A,,N/A,,,negative,0.7575,negative,0.7575,negative,0.7575
"@cesarcaesar8480 well mine also has these issues and this is the reason i switched to op13 that has non of them. Am i also a ""pseudo-analyst""? You do understand that you usage is completely different from mine or another's? If you use the camera, chrome browsing and playing/watching youtube videos, the phone 1) gets hot and 2) loses tons of battery. These are facts. The issue lies with software 100% which xiaomi MUST FIX. Stop giving passes to companies that took you 1000+ $ and gave you a crappy software experience. I really wanted to love the 15 ultra but it turned out to have the exact same issues with 14 ultra. POOR BATTERY LIFE.",overall,Subjective,overall,overall,negative,0.7049,N/A,,N/A,,N/A,,,negative,0.7049,negative,0.7049,negative,0.7049
My last Xiaomi phone is Mi mix 3 stull using it with my Poco F3. Still hoping for the next No camera notch display which MiX 4 attempted but failed in quality.,overall,Subjective,overall,overall,neutral,0.5638,N/A,,N/A,,N/A,,,neutral,0.5638,neutral,0.5638,neutral,0.5638
What really makes me angry is that Xiaomi CHOSE to fit a SMALLER battery for the global model. They know that the camera would be consuming the battery more than any other phone…yet they decide to DOWNSIZE the battery for the global model and increase the price?!,overall,Subjective,overall,overall,negative,0.859,N/A,,N/A,,N/A,,,negative,0.859,negative,0.859,negative,0.859
"No phone is perfect.. tell me about Xiaomi 15 Ultra issues, too..",overall,Subjective,overall,overall,negative,0.7617,N/A,,N/A,,N/A,,,negative,0.7617,negative,0.7617,negative,0.7617
"Ngl, I swore off Apple after leaving my SE gen 2 for a Pixel 8, but screen problems have pushed me to need an upgrade sooner than I wanted. The better features of the iPhone 17 have me seriously considering it over the Pixel 10, which isn't something I thought I'd say even a few months ago. Kudos to Apple for delivering an extremely solid product on this one!",overall,Subjective,overall,overall,positive,0.4204,N/A,,N/A,,N/A,,,positive,0.4204,positive,0.4204,positive,0.4204
"@OGTennyson It’s not worth the upgrade coming from an S22. Cameras are almost exactly the same (I looked into sensor sizes etc.) and the screen hasn‘t improved that much either. iPhone 17 is simply the better phone this time having a better screen, battery life, ultrawide and front camera. The only reason to consider S25 over iPhone 17 is the price, as in most countries it’s considerably cheaper than even iPhone 16.",overall,Subjective,overall,overall,negative,0.733,N/A,,N/A,,N/A,,,negative,0.733,negative,0.733,negative,0.733
Always siya sold out sa Power Mac Center tapos ang naiwan nalang ay 1 terabyte kaya sa Digital Walker nalang ako bumili. Massive upgrade from Samsung A15 5G to Iphone 17 base model white 256gb. And also hindi lang siya 2x lang hanggang 10x zoom po siya.,overall,Subjective,overall,overall,neutral,0.6009,N/A,,N/A,,N/A,,,neutral,0.6009,neutral,0.6009,neutral,0.6009
"That just makes me want to upgrade even more from my iPhone 12 for my second channel Hawkins tech vlogs I will be able to record using the rear facing camera of my iPhone 17 and if I wanna show my face, I can record from both the rear and the front facing cameras at the same time. I would love to try out that feature if I ever get the iPhone 17",overall,Subjective,overall,overall,positive,0.9576,N/A,,N/A,,N/A,,,positive,0.9576,positive,0.9576,positive,0.9576
"I have an iPhone 12 mini, and I need an upgrade. I was thinking of getting a 15 Pro because I appreciate some better camera features. Should I get the regular iPhone 17 instead?",overall,Subjective,overall,overall,positive,0.6247,N/A,,N/A,,N/A,,,positive,0.6247,positive,0.6247,positive,0.6247
my $200 has more ram than iphone 17. Apple is amazing lol,overall,Subjective,overall,overall,positive,0.9681,N/A,,N/A,,N/A,,,positive,0.9681,positive,0.9681,positive,0.9681
"i'm prolly gonna upgrade from samsung s24 to this iphone 17, would it be a good choice?",overall,Subjective,overall,overall,neutral,0.6035,N/A,,N/A,,N/A,,,neutral,0.6035,neutral,0.6035,neutral,0.6035
Eto na yta ang sign to buy iphone 17 this year. Pinakasulit sa lahat ng phone. But still thinking to buy SG S25 Ultra. Ang hirapp magdecide😅,overall,Subjective,overall,overall,neutral,0.7897,N/A,,N/A,,N/A,,,neutral,0.7897,neutral,0.7897,neutral,0.7897
"Correction: the iPhone 17 base has mmWave (qualcomm x80 modem). its only the iPhone Air with the C1X modem that doesnt have mmWave this Xonedium is great, thanks for the headsup",overall,Subjective,overall,overall,positive,0.6925,N/A,,N/A,,N/A,,,positive,0.6925,positive,0.6925,positive,0.6925
These are the resuls: 1nd: iphone 17 pro max: 13 hours. 2nd: iphone 16 pro max: 12 hours 15 min. 3rd: samsun S25 ultra : 11 hours 58 min. 4th: iphone 17 pro : 10 hours 48 min. 5th: iphone 17: 10 hours 28 min. 6th: iphone 16: 9 hours 51 min. 7th: iphone Air: 7 hours 18 min. Never had a regret of getting an iphone 16. Thankyou.,overall,Subjective,overall,overall,neutral,0.5225,N/A,,N/A,,N/A,,,neutral,0.5225,neutral,0.5225,neutral,0.5225
Typing from my today fresh iPhone 17. This is my first time upgrading since an iPhone 13 and you’ve made me feel like I picked a great time to finally upgrade! Go 17!,overall,Subjective,overall,overall,positive,0.9791,N/A,,N/A,,N/A,,,positive,0.9791,positive,0.9791,positive,0.9791
"I know this is an iphone video, but as someone that switched to Samsung for the first time last year, I can't recommend it more. This is the first phone I've had that allows me to not worry about charging it every night and I love that you can control how aggressive to make the low power mode to get even more time out of it!",overall,Subjective,overall,overall,positive,0.9626,N/A,,N/A,,N/A,,,positive,0.9626,positive,0.9626,positive,0.9626
"I also traded my iPhone 12 mini in Black for iPhone 17 Lavender - while happy about the color and the upgrade, really really miss my tiny but mighty soldier!! 🥲🥲🥲",overall,Subjective,overall,overall,positive,0.4788,N/A,,N/A,,N/A,,,positive,0.4788,positive,0.4788,positive,0.4788
Complete junk of brand new iPhone 17 pro if it over heats. Buy a zfold 7. I love mine. Never over heats.,overall,Subjective,overall,overall,positive,0.554,N/A,,N/A,,N/A,,,positive,0.554,positive,0.554,positive,0.554
"using iphone 17 lavender <3 overall okay! Just set battery and other settings para mas matagal, isang charge lang me everyday! ghanda ng camera ahhh",overall,Subjective,overall,overall,positive,0.8686,N/A,,N/A,,N/A,,,positive,0.8686,positive,0.8686,positive,0.8686
"Honest take from someone naka iphone 13/14 Hindi siya ganun ka significant upgrade. Maguupgrade ka lang talaga pag sira na gamit mong iphone. Pero one thing is for sure, iphone 17 ang best base iphone.",overall,Subjective,overall,overall,positive,0.624,N/A,,N/A,,N/A,,,positive,0.624,positive,0.624,positive,0.624
Upgrade from iPhone 15 green apple to iPhone 17 Mist Blue❤,overall,Subjective,overall,overall,positive,0.931,N/A,,N/A,,N/A,,,positive,0.931,positive,0.931,positive,0.931
@ArjunPraharaj The samsung s25 is still faster than a brand new iphone 17 pm though. Take that in...,overall,Subjective,overall,overall,positive,0.6039,N/A,,N/A,,N/A,,,positive,0.6039,positive,0.6039,positive,0.6039
Bro how does it have better battery than pixel 10 if pixel has almost 5000mah and iphone has 3700?,overall,Subjective,overall,overall,neutral,0.4647,N/A,,N/A,,N/A,,,neutral,0.4647,neutral,0.4647,neutral,0.4647
Is buying iphone 17 an upgrade from s21 ultra? I want to switch to iphone but is it an upgrade,overall,Subjective,overall,overall,neutral,0.8313,N/A,,N/A,,N/A,,,neutral,0.8313,neutral,0.8313,neutral,0.8313
@exe9790infinix note 30 is not that good. kaya cheaper siya kasi its nowhere near as good as the iphone 17.,overall,Subjective,overall,overall,negative,0.9259,N/A,,N/A,,N/A,,,negative,0.9259,negative,0.9259,negative,0.9259
I been waiting for this video!!! I’m thinking about getting the iPhone 17 and this video is just about sealing the deal for me!,overall,Subjective,overall,overall,positive,0.9805,N/A,,N/A,,N/A,,,positive,0.9805,positive,0.9805,positive,0.9805
Currently I am using a android should I buy a Iphone 16 or Iphone 17 or buy a good android smartphone about 450 dollers and save the rest of the money,overall,Subjective,overall,overall,neutral,0.7616,N/A,,N/A,,N/A,,,neutral,0.7616,neutral,0.7616,neutral,0.7616
We need a UK vs US iPhone 17 Pro Max test!! (eSIM only vs SIM card tray),overall,Subjective,overall,overall,neutral,0.654,N/A,,N/A,,N/A,,,neutral,0.654,neutral,0.654,neutral,0.654
"I didn’t really have much reason to upgrade to the 17 until I saw the 256 gb, 120hz display, and the new selfie camera. I would understand the 17 pro having those features, but the fact it went to the base as well completely sold me on it. I’m sure there’s probably those that switched/bought the 17 for those reasons as well. Definitely a good phone to upgrade to if someone has been looking for the next great base iPhone.",overall,Subjective,overall,overall,positive,0.8712,N/A,,N/A,,N/A,,,positive,0.8712,positive,0.8712,positive,0.8712
You definitely regret it for not waiting till iPhone 17 😂,overall,Subjective,overall,overall,neutral,0.474,N/A,,N/A,,N/A,,,neutral,0.474,neutral,0.474,neutral,0.474
Arun dropping the iphone 17 into the other phones hurt me and my wallet on a physical level,overall,Subjective,overall,overall,negative,0.7295,N/A,,N/A,,N/A,,,negative,0.7295,negative,0.7295,negative,0.7295
"Who wants a thin phone? I can understand lighter, but thin at the cost of battery life? The 3 year old Xiaomi 11 Lite NE is lighter than iPhone Air, and has longer battery life. And costs less than $250 now.",overall,Subjective,overall,overall,neutral,0.5817,N/A,,N/A,,N/A,,,neutral,0.5817,neutral,0.5817,neutral,0.5817
"sa mga naka-iphone 17 here, kamusta battery sa isang araw with casual gaming?",overall,Subjective,overall,overall,neutral,0.8982,N/A,,N/A,,N/A,,,neutral,0.8982,neutral,0.8982,neutral,0.8982
​@chez4U oh yeah correct - but mind blowing how the s24 in terms of battery beat the IP 16 PM last year but the same IP 16 PM this year beat even the latest s25...software improvements for iphone or battery downgrade for Samsung?? 😅,overall,Subjective,overall,overall,positive,0.7531,N/A,,N/A,,N/A,,,positive,0.7531,positive,0.7531,positive,0.7531
I got an iPhone 17 upgrade from Verizon should I get it?,overall,Subjective,overall,overall,neutral,0.7101,N/A,,N/A,,N/A,,,neutral,0.7101,neutral,0.7101,neutral,0.7101
would it be a good decision to switch to iPhone 17 from S24U?,overall,Subjective,overall,overall,neutral,0.8849,N/A,,N/A,,N/A,,,neutral,0.8849,neutral,0.8849,neutral,0.8849
planning to upgrade iphone 17 from iphone 16 pro max. if sulit ba. :),overall,Subjective,overall,overall,positive,0.6759,N/A,,N/A,,N/A,,,positive,0.6759,positive,0.6759,positive,0.6759
"coming from an s8+, should i get the iphone 16 pro max or iphone 17?",overall,Subjective,overall,overall,neutral,0.8447,N/A,,N/A,,N/A,,,neutral,0.8447,neutral,0.8447,neutral,0.8447
do you know why the iphone 16 has better battery this year than last year? is it teh ios 26?,overall,Subjective,overall,overall,positive,0.6616,N/A,,N/A,,N/A,,,positive,0.6616,positive,0.6616,positive,0.6616
"@AshersRandomFunFactsmine is not broken yet and even if the battery is almost totally gone, I am not going to buy a new phone soon. I am saving money just in case it abandons me suddenly but at this point I am wondering if buying again iPhone is worth my money, seriously.",overall,Subjective,overall,overall,negative,0.4881,N/A,,N/A,,N/A,,,negative,0.4881,negative,0.4881,negative,0.4881
"Finally upgraded from my iPhone 11 to the 17. The battery, storage and screens feel absolutely night and day. This is the best time to upgrade there has ever been for iphones",overall,Subjective,overall,overall,positive,0.9853,N/A,,N/A,,N/A,,,positive,0.9853,positive,0.9853,positive,0.9853
I had iPhone 12 mini in green and traded it in for iPhone 17 base in green. I will forever miss my 12 mini 😭😭😭,overall,Subjective,overall,overall,negative,0.4573,N/A,,N/A,,N/A,,,negative,0.4573,negative,0.4573,negative,0.4573
"Just to consider the fact that the iPhone 16 pro max is over a year old and still managed to come really close to the brand new iPhone 17 pro max, it’s a win for the 16 pro max",overall,Subjective,overall,overall,positive,0.9035,N/A,,N/A,,N/A,,,positive,0.9035,positive,0.9035,positive,0.9035
Wild how the iPhone 17 Pro manages to be the most ‘Pro’ iPhone ever while still being the most mainstream. Love the thicker design with bigger battery + better cooling 🔥📱,overall,Subjective,overall,overall,positive,0.9686,N/A,,N/A,,N/A,,,positive,0.9686,positive,0.9686,positive,0.9686
"Going from the iPhone 13 Pro to the iPhone 17 Pro, I feel like I have a completely new iPhone. Not used to the Dynamic Island and all the new features but I love the new camera quality.",overall,Subjective,overall,overall,positive,0.978,N/A,,N/A,,N/A,,,positive,0.978,positive,0.978,positive,0.978
surprised and really happy when iphone 17 pro improved battery a lot compare last video (even same ios 26.3.1 version),overall,Subjective,overall,overall,positive,0.9707,N/A,,N/A,,N/A,,,positive,0.9707,positive,0.9707,positive,0.9707
I have the orange iPhone 17 Pro Max and I love the orange color …. I thought mine did have a titanium body. I was just looking it over before I watch this video and just cleaned it all up. I do construction not a single scratch on it and I always scratch up my iPhone,overall,Subjective,overall,overall,positive,0.9226,N/A,,N/A,,N/A,,,positive,0.9226,positive,0.9226,positive,0.9226
This intro is better than apple's iPhone 17 pro intro,overall,Subjective,overall,overall,positive,0.9336,N/A,,N/A,,N/A,,,positive,0.9336,positive,0.9336,positive,0.9336
"I don't think this iPhone lacks AI, but something to get people excited about. Basically, when you go from the iPhone 11, 12, 13 to the 17, you get a phone with a nicer screen, more battery, and a better camera... Samsung released the Fold and Flip series, Huawei brought a professional camera to a smartphone (with Pura 80) and a trifold, Xiaomi is exciting with a screen in the camera module, even One Plus has a passport-shaped phone... Apple needs to make a phone that excites the people one more time",overall,Subjective,overall,overall,positive,0.8562,N/A,,N/A,,N/A,,,positive,0.8562,positive,0.8562,positive,0.8562
The greatest paradox of the iPhone 17 Pro: the most “pro” iPhone ever… is also the most mainstream phone Apple has ever made.,overall,Subjective,overall,overall,positive,0.599,N/A,,N/A,,N/A,,,positive,0.599,positive,0.599,positive,0.599
The RAM isn't needed for on device AI. My app is currently in beta and it uses Apple Intelligence foundation model and not only does it run great on iPhone 16 pro it also barely gets hot now.,overall,Subjective,overall,overall,positive,0.8048,N/A,,N/A,,N/A,,,positive,0.8048,positive,0.8048,positive,0.8048
you should make a iphone 17 pro max vs s25 ultra vs pixel 10 pro xl,overall,Subjective,overall,overall,neutral,0.7868,N/A,,N/A,,N/A,,,neutral,0.7868,neutral,0.7868,neutral,0.7868
Thank you for this review as I have now just ordered the iPhone 17 pro because of your amazing information,overall,Subjective,overall,overall,positive,0.9842,N/A,,N/A,,N/A,,,positive,0.9842,positive,0.9842,positive,0.9842
After having a phone older than me since I was 9 I’m FINNALY getting the iPhone 17 pro is cosmic orange,overall,Subjective,overall,overall,positive,0.5517,N/A,,N/A,,N/A,,,positive,0.5517,positive,0.5517,positive,0.5517
I went from iPhone 11 Pro to iPhone 17 Pro Max xD my first Max too!! Such a huge upgrade holy frick my iPhone 11 Pro felt like it'd explode everytime i did anything like game xD,overall,Subjective,overall,overall,positive,0.9158,N/A,,N/A,,N/A,,,positive,0.9158,positive,0.9158,positive,0.9158
I still can't justify upgrading from iPhone 15 Pro Max with titanium to go to aluminum. I held the phone and it feels and looks cheap to me. Sure the camera is a slight upgrade but not worth the upgrade yet. They should try to keep titanium for the Pro Max at least.,overall,Subjective,overall,overall,negative,0.7793,N/A,,N/A,,N/A,,,negative,0.7793,negative,0.7793,negative,0.7793
"Most people don't need a flagship phone like the iPhone 17 Pro. If the iPhone 12 just came out today, I would be fine with that and happy.",overall,Subjective,overall,overall,positive,0.4593,N/A,,N/A,,N/A,,,positive,0.4593,positive,0.4593,positive,0.4593
"iphone is overrated. 17 vs 13 has almost no difference, even worse because of this thermal issue.",overall,Subjective,overall,overall,negative,0.9305,N/A,,N/A,,N/A,,,negative,0.9305,negative,0.9305,negative,0.9305
"I hate Apple Everything is a money scam But my iPhone has serious overheating issues, and I hate the low ram, so I reall want a 17",overall,Subjective,overall,overall,negative,0.9487,N/A,,N/A,,N/A,,,negative,0.9487,negative,0.9487,negative,0.9487
If you’re in the tech world you know the standard 17 is the preferred upgrade no matter what iPhone you’re coming from unless you’re dying for larger battery + brighter screen/USB 3.0,overall,Subjective,overall,overall,neutral,0.469,N/A,,N/A,,N/A,,,neutral,0.469,neutral,0.469,neutral,0.469
"I’ve worked in the cell phone business for 10 years now for AT&T , Tmobile, & Verizon. For very busy stores BTW here in Center City Philly & I can say with a fact that more people buy the base model than any of the iPhones. Maybe apple sales are one one thing but for cell phone carriers I promise you it’s something different",overall,Subjective,overall,overall,positive,0.5808,N/A,,N/A,,N/A,,,positive,0.5808,positive,0.5808,positive,0.5808
"Sponsorships on this channel is a lot more realistic, instead of saying that the phone case was the ""only way"" to reduce scratches, he also showed us the grey version, I would probably buy the grey iphone instead of the case, so he might get less money, but it will be more usefull for us, viewers Thank you arun for being honest and always trying to help us, u are the best ❤",overall,Subjective,overall,overall,positive,0.6889,N/A,,N/A,,N/A,,,positive,0.6889,positive,0.6889,positive,0.6889
That's because your old phone battery was toast. Should have just replaced the battery for $69 and called it a day instead of flush a grand down the toilet for slightly better cameras and screen hahaha,overall,Subjective,overall,overall,negative,0.8374,N/A,,N/A,,N/A,,,negative,0.8374,negative,0.8374,negative,0.8374
"They need to look at what Xiomei just did with their 17 Pro Max. 50% bigger battery with 100W Fast charging, 16GB of RAM, 8k video, higher resolution main screen, and a rear screen. Amazing!",overall,Subjective,overall,overall,positive,0.9461,N/A,,N/A,,N/A,,,positive,0.9461,positive,0.9461,positive,0.9461
"I'll steal this thread to point out for potential video makers wanting an iPhone, watch out because I found out the hard way that ProRes RAW isn't actually RAW. It still does noise reduction which sometimes makes for weird footage. Best to get motioncam on an android",overall,Subjective,overall,overall,negative,0.5278,N/A,,N/A,,N/A,,,negative,0.5278,negative,0.5278,negative,0.5278
"I think we are getting ready for satcom phones. Satcom is a very performance intensive, battery draining and heats up the device. Makes sense as to why the sim tray was removed, don’t need SIM cards with satcom. I’m guessing Apple will start offering phone plans where you can use satcom versus traditional cell plans, so no dead zones nor would you have to switch plans when you travel to another country. I think it’ll be the next “big thing”",overall,Subjective,overall,overall,neutral,0.616,N/A,,N/A,,N/A,,,neutral,0.616,neutral,0.616,neutral,0.616
"Dudes, I bought an iPhone Air this year instead of the Pro—I always buy the high end phone. I hope next year the Air is a Pro too. That’s what I’ll be buying. :)",overall,Subjective,overall,overall,positive,0.9125,N/A,,N/A,,N/A,,,positive,0.9125,positive,0.9125,positive,0.9125
