text,comment_category,final_subjectivity_label,aspect_input,pipeline,roberta_sentiment,roberta_confidence,deberta_base_sentiment,deberta_base_confidence,deberta_base_finetuned_sentiment,deberta_base_finetuned_confidence,deberta_large_sentiment,deberta_large_confidence,deberta_models_agree,final_base_sentiment,final_base_confidence,final_finetuned_sentiment,final_finetuned_confidence,final_large_sentiment,final_large_confidence
"I have Xiaomi 15....Can u tell me how to unsync gallery with google photos ? I mean if I am syncing my gallery with google photos, all google photos are adding up in my gallery app also....In other phones like Samsung or OP, this is not the case...in these phones after adding to Google photos, we can delete in gallery app.... Hope I am clear..",camera,Subjective,photo and video quality,absa,N/A,,neutral,0.5937,neutral,0.5144,neutral,0.9875,True,neutral,0.5937,neutral,0.5144,neutral,0.9875
"I have Xiaomi 15....Can u tell me how to unsync gallery with google photos ? I mean if I am syncing my gallery with google photos, all google photos are adding up in my gallery app also....In other phones like Samsung or OP, this is not the case...in these phones after adding to Google photos, we can delete in gallery app.... Hope I am clear..",camera,Subjective,photo and video quality,absa,N/A,,neutral,0.5937,neutral,0.5144,neutral,0.9875,True,neutral,0.5937,neutral,0.5144,neutral,0.9875
"I want to make sure whether my decision will be good or not during this Big Billion Days sale. I have searched all over the internet but couldn’t find a proper comparison video between the iQOO 13, Vivo X200 FE, and Xiaomi 15. I am confused between these three devices, so kindly suggest which one to consider to help me make a smart purchase during the Big Billion Days.",camera,Subjective,photo and video quality,absa,N/A,,neutral,0.8369,neutral,0.7931,neutral,0.7436,True,neutral,0.8369,neutral,0.7931,neutral,0.7436
"I purchased a newly Xiaomi 15 in July everything is performing good but suddenly hyperOs 2.0 come and updated it's after that one biggest issue come to new Xiaomi 15 is Camera lagging , quality low-high , Zooming problem , blurring image in 1× and 2× , also Camera not working properly it's crashing , Also factory reset it not solved this problem , Can anyone help me with this ?",camera,Subjective,photo and video quality,absa,N/A,,negative,0.937,negative,0.8842,negative,0.9695,True,negative,0.937,negative,0.8842,negative,0.9695
"@uncoverplus Haha thank you for recognising me. I find your videos more original, sincere and trustworthy than the other big creators cos most of them do paid promotions and sometimes they don’t point out the major cons of the phones they review. Anyway, I am stuck between the oneplus 13s and the Xiaomi 15. I love them both but the one plus doesnt have what the Xiaomi has and vice versa. So I am stuck.",camera,Subjective,photo and video quality,absa,N/A,,positive,0.665,positive,0.5765,positive,0.6848,True,positive,0.665,positive,0.5765,positive,0.6848
Didn't expect to watch this video on my green Xiaomi 15. It's bloody amazing.,camera,Subjective,photo and video quality,absa,N/A,,positive,0.9822,positive,0.9629,positive,0.9984,True,positive,0.9822,positive,0.9629,positive,0.9984
"​@Factss_101Here is a quick battery feedback from Xiaomi 14 user: My shift starts around 4AM, I am heavy user and it usually takes until 10PM to drain it completely. I put it on the original 90W charger and is 100% full in like 30 minutes, even without enabling boost charging option. In short - battery is amazing for a smaller phone, and charging is nothing short of spectacular.",charging,Subjective,charging,absa,N/A,,positive,0.9242,positive,0.921,positive,0.8537,True,positive,0.9242,positive,0.921,positive,0.8537
"No matter how good the phones are, people buy them because they offer great hardware at great prices. What is it with these companies charging iPhone or Galaxy prices? People will just buy those instead.",charging,Subjective,charging,absa,N/A,,negative,0.7219,neutral,0.7616,neutral,0.8011,True,negative,0.7219,neutral,0.7616,neutral,0.8011
"Hello from Romania! Being one of the favorite compact phone to you, what do you advise me, I allready have Xiaomi 15, is it worth to change it with Xiaomi 17? I saw that both are a little bit warm to your throttling test, but overall, i like the 17 design very much, the cameras and the fact that they put a larger battery. Cheers to u all! ✌️ Looking forward to your opinion",design,Subjective,phone design,absa,N/A,,positive,0.6987,positive,0.7148,positive,0.9824,True,positive,0.6987,positive,0.7148,positive,0.9824
"This year is gonna be a good year for more compact phones. We have the Xiaomi 15 and the Vivo x200 Mini, and we have the upcoming Oneplus 13T or Mini and the regular iPhone 17 finally coming with a more competitive spec sheet. Personally, I might opt for the OnePlus, but I'll see what the iPhone brings to the table.",design,Subjective,phone design,absa,N/A,,positive,0.7007,positive,0.6945,positive,0.5152,True,positive,0.7007,positive,0.6945,positive,0.5152
"6.3 is now compact lmao but its so much better than the 6.7 giant of a mobile phone iam having right now, will upgrade when xiaomi 15 is on sale",design,Subjective,phone design,absa,N/A,,positive,0.5763,positive,0.777,neutral,0.9681,False,positive,0.5763,positive,0.777,neutral,0.9681
"Looks like a great phone, though there are rumors Xiaomi will drop compact phones with the Xiaomi 16. Hope not, more options is always better than less (or none). S25 vs Xiaomi 15?",design,Subjective,phone design,absa,N/A,,neutral,0.6853,neutral,0.6668,positive,0.7706,False,neutral,0.6853,neutral,0.6668,positive,0.7706
"Uncle Spurt, I love your review. I've been a big fan for years. I love the Xiaomi 15, it's a perfect size. The problem is I unfortunately live in the US. Is there a way to buy one?",design,Subjective,phone design,absa,N/A,,positive,0.7392,positive,0.7273,positive,0.9915,True,positive,0.7392,positive,0.7273,positive,0.9915
"That's true. I switched from an 17pro iPhone back to the Xiaomi 15, the Leica Look and the details are a LOT better",design,Subjective,phone design,absa,N/A,,positive,0.794,positive,0.9122,positive,0.8974,True,positive,0.794,positive,0.9122,positive,0.8974
"Hello guys ,can you help me?I would like to upgrade from the s23 and I'm undecided between the XIAOMI 15 and the ONE PLUS 13. I take pictures occasionally, I use it a lot to listen to music and do tasks. On the S23 I had problems with the screen being burned. Can you help me with an opinion, which phone should I choose, Xiaomi or one plus 13? P.S. I had a xiaomi 11i long time ago with the same issue like S23 (Screen burn)",display,Subjective,display and user interface,absa,N/A,,neutral,0.54,neutral,0.6426,neutral,0.9437,True,neutral,0.54,neutral,0.6426,neutral,0.9437
"Google Pixel is still better no matter what Xiaomi does, but it's great that they finally made a normal 6.3 screen.",display,Subjective,display and user interface,absa,N/A,,positive,0.5037,neutral,0.5298,neutral,0.5976,True,positive,0.5037,neutral,0.5298,neutral,0.5976
6 inches now is equivalent to 5 inches back then because back then the screen was 30% edges and bezels. Also now phones are way slimmer and light and UIs are way more ergonomic so that usage comfort is greatly improved.,display,Subjective,display and user interface,absa,N/A,,neutral,0.5698,neutral,0.5569,positive,0.9456,False,neutral,0.5698,neutral,0.5569,positive,0.9456
Can you just stop using anime wallpapers for the reviews please? I know you like anime we also do. But it just doesn’t look good neither we can look properly to the screen bezels whenever come to watch your videos just for the display part your wallpapers force me to leave the video. Just review the phone as it is come out of the box or set a normal wallpaper which is brighter so bezels can be seen. I hope you understand,display,Subjective,display and user interface,absa,N/A,,negative,0.9199,negative,0.795,negative,0.9458,True,negative,0.9199,negative,0.795,negative,0.9458
@Wasimillusions for long term & good performance i guess you need to see xiaomi 15,performance,Subjective,performance and speed,absa,N/A,,positive,0.7637,positive,0.8073,neutral,0.9174,False,positive,0.7637,positive,0.8073,neutral,0.9174
no need compare xiaomi 14..direct buy 15 if u are thinking between tis two phone..15 have better chipset & ultrasonic fingerprint & new OS2.0 & Better batery performance & upgraded to m9 display glass & upgraded hand on design.😊,performance,Subjective,performance and speed,absa,N/A,,positive,0.9249,positive,0.9124,positive,0.9626,True,positive,0.9249,positive,0.9124,positive,0.9626
"I've only ever had small phones (Nokia 6100 was ideal for me) so I'm only looking at the smallest Androids for my next unit. Xiaomi 15's biggest problem is that Galaxy S25 exists and not only does it have longer support (7 years vs 5) but it's also slightly cheaper (unless you buy a Xiaomi combo with a tablet, bla bla). HOWEVER, both phones are nuked by the S24 which is nearly half the price and you only lose very marginal things. S24's value is outstanding.",price,Subjective,price and value,absa,N/A,,positive,0.8721,positive,0.825,positive,0.9101,True,positive,0.8721,positive,0.825,positive,0.9101
"I was looking for this xiaomi 15, after my mi 10t pro was involved in a bike accident. The display started to misbehave even if it not cracked. But then I saw the previous xiaomi 14 for 450 euros, the 512 Gb version and the charger is included in the box, For this price I think it's OK. And the 14t pro is another great option but it's bigger. The 15 is also on the compact side. More powerful hardware, but it will be available for over 1000 euros. I was thinking to return the 14, but after a few days using it, it will stay.",price,Subjective,price and value,absa,N/A,,neutral,0.7789,neutral,0.7792,positive,0.6277,False,neutral,0.7789,neutral,0.7792,positive,0.6277
"The pricing is absolutely insane. Here you can often buy S23 or S24 for ~$500 because people are selling them NIB when they renew their phone plans on black friday etc. Last time I was deciding between Xiaomi 13 and S23, I could get the S23 for $500 CAD but the Xiaomi 13 global was $900 CAD on aliexpress. Now I'm looking and Xiaomi 15 is $1450 CAD and S25 is $800ish.",price,Subjective,price and value,absa,N/A,,positive,0.7272,positive,0.7006,neutral,0.6037,False,positive,0.7272,positive,0.7006,neutral,0.6037
I bought xiaomi 16 pro from factory best price best phone better then Xiaomi 15,price,Subjective,price and value,absa,N/A,,positive,0.785,positive,0.865,positive,0.9996,True,positive,0.785,positive,0.865,positive,0.9996
Hi do you think itd be worth it for me to get rhe Xiaomi 15 even if its china rom? the seller said i can downlosd google services and use english so do you say its worth it?,price,Subjective,price and value,absa,N/A,,neutral,0.7962,neutral,0.8559,neutral,0.9885,True,neutral,0.7962,neutral,0.8559,neutral,0.9885
"The most amazing thing about Xiaomi 15 is that the even better Pro model is only 750$ if importing from China, and it blows the 800-1000$ Samsungs, Pixels and iPhones out of the water spec-wise. Of course youll have to deal with he Chinese ROM as the downside though.",price,Subjective,price and value,absa,N/A,,positive,0.7956,positive,0.7361,positive,0.6171,True,positive,0.7956,positive,0.7361,positive,0.6171
"Like other Chinese smartphone brands they're very selective on what comes out in the market. Usually the super expensive Ultras and Pros are only release in EU where people can afford it. In other places like SEA they usually stick the trimmed down version of the flagship like the base Xiaomi 15 or the base Oppo Find X8 to undercut the incredibly expensive iPhones and Samsungs that are almost twice the price, which most people can't afford anyway.",price,Subjective,price and value,absa,N/A,,neutral,0.3812,neutral,0.5153,positive,0.5042,False,neutral,0.3812,neutral,0.5153,positive,0.5042
Hi! Could I ask what version of hyperos are you on? And do you have a feature where while taking a video your able to snap a picture at the same time? Similarly to Samsung I own a xiaomi 15 too and am hesitant to update to 2.0.218.0 and also remembered a feature like I mentioned in the video section.. Or maybe I just remembered my old samsung,software,Subjective,software,absa,N/A,,neutral,0.9433,neutral,0.9368,neutral,0.9665,True,neutral,0.9433,neutral,0.9368,neutral,0.9665
"Hii sir i don't know if you'll replay to my comment or not but if you're seeing my comment the plss answer my question, I want to start photography and videography, I've been xiaomi user for last 3years nd I like the software of xiaomi so i wanted to know if xiaomi 15 is actually a good phone if I'm using always pro mode plss reply",software,Subjective,software,absa,N/A,,positive,0.7754,neutral,0.5051,positive,0.9487,False,positive,0.7754,neutral,0.5051,positive,0.9487
People so much sensitive with the software while what you will do is just chat wazzup call text YouTube games location 😂 dumb people what do you think of your phone for design?😂 Useless brain you can customize an Android in anything you want. I'm using Xiaomi 15 since launch I got no issue with software I know how to tweek my phone it's very easy.😂 Meaning you don't have a brain only even if you study 😂,software,Subjective,software,absa,N/A,,negative,0.8916,negative,0.7972,negative,0.9945,True,negative,0.8916,negative,0.7972,negative,0.9945
I have the Xiaomi 15. It is really a superb smartphone. I use it as my android phone alongside with my iPhone 15 Pro. 😊,software,Subjective,software,absa,N/A,,positive,0.844,positive,0.8941,positive,0.9948,True,positive,0.844,positive,0.8941,positive,0.9948
@levipb1403 Xiaomi phone actually more cheaper and just take 5% profit different from Samsung Galaxy where is overpriced and you want they to have clean ui without worrying about they revenue for r&d or pay salary for they employee. Look like you are greedy and the Samsung animation on their ui is so boring that not have good animation and about bug note 20 update just get problem because after update the phone get bootloop and need to factory reset. So what you want? Device that have competitive price without bug? Oh I recommend you to using rock🤡🤡🤡,software,Subjective,software,absa,N/A,,negative,0.8972,negative,0.8301,negative,0.9342,True,negative,0.8972,negative,0.8301,negative,0.9342
"​@alxdava2004 meantime,I actually bought X15.ok phone,dual apps,good camera,speed charging,i'm fine.On the other side, global rom is so generic software(but also think not worse than basic google p9 android...).Shame Samsung s series don't have better cameras:)",software,Subjective,software,absa,N/A,,negative,0.8022,negative,0.4374,negative,0.9467,True,negative,0.8022,negative,0.4374,negative,0.9467
"​@andrewshiu5872I'm using Xiaomi 14 as my daily driver, I don't agree with you on hyper os , it's ok but not great, messenger bubbles bug still exists after years, notifications never arrive sometimes or they arrive AFTER I've turned off the wifi",software,Subjective,software,absa,N/A,,negative,0.5621,negative,0.5207,negative,0.9714,True,negative,0.5621,negative,0.5207,negative,0.9714
"Also the camera have weirs settings like hdr ai and ai camera which doesn't do anything but worsen the skin tones even more, xiaomi have tons of features but none of them are useful like the fastshot mode which doesn't work that great.",software,Subjective,software,absa,N/A,,negative,0.916,negative,0.8538,negative,0.5758,True,negative,0.916,negative,0.8538,negative,0.5758
"So pleased I returned it and went for the iPhone 17 pro, much better experience, amazing battery life, camera is on par with the 15 ultra, and I also find that user experience is way better, xiaomi 15 ultra is basically an average smartphone aligned with a European camera manufacturer.",battery,Subjective,battery life,absa,N/A,,positive,0.8879,positive,0.8662,neutral,0.9945,False,positive,0.8879,positive,0.8662,neutral,0.9945
Man you are saying your Day to day task temperature reaches 37/38°c 😂😂That Issue im facing in Ideal mode . My Xiaomi 15 ultra Is always on 36-38°C On ideal mode . But im living in india and current season is summer 🌞 and my city temp is almost like 38 to 40°c so i think 36/38° c Phone temp is normal for me. But it feels warm and after 5 min of use I feel like my phone will blast and i thinking it will cause Screen burning issue and Outdoor usage is the worst part battery really sucks cause of overheating,battery,Subjective,battery life,absa,N/A,,negative,0.946,negative,0.8644,negative,0.9863,True,negative,0.946,negative,0.8644,negative,0.9863
"Got the xiaomi 15 ultra...the cameras are simply STUNNING. The thermals and battery are VERY bad. So i went out an got a op13. Being playing with both for a week now...yeah cameras of 15ultra are out of this word...but the battery and charging speed of op13 are also epic while the cameras are just ""ok good"". I really want the 15ultra to get the optimization of one op13 to boost its battery stamina, otherwise i ll have to only keep the op13 and ditch the 15ultra. So disappointed.",battery,Subjective,battery life,absa,N/A,,positive,0.8631,positive,0.6627,positive,0.4793,True,positive,0.8631,positive,0.6627,positive,0.4793
"Bro, njan Xiaomi 15 ultra aanu use cheyyunnath. The camera performance is exceptional. Pinne ee paranja battery drain issue enikk ondayirunnu, but athrakk velya prashnam face cheythittilla. Previous update kazhinjappo erekkore ok aayittond enikk",battery,Subjective,battery life,absa,N/A,,negative,0.8745,negative,0.4872,negative,0.7512,True,negative,0.8745,negative,0.4872,negative,0.7512
"My 15U battery life is OK. I get around 5 hours usage on screen and in everything still around 30% left. Once done over 7,5h for two days, from 100% to 0% So it's not bad Compared to my old Xiaomi mi 11Ultra that from new done max 4,5h (mostly around 4h)",battery,Subjective,battery life,absa,N/A,,neutral,0.5547,neutral,0.6528,neutral,0.6725,True,neutral,0.5547,neutral,0.6528,neutral,0.6725
"​@boostinggtirtimeno still warm to touch even with latest firmware update and the best part, watching youtube drain battery while cooking the phone like an ultra (better than pro!) SHAME ON YOU XIAOMI",battery,Subjective,battery life,absa,N/A,,negative,0.9171,positive,0.5364,negative,0.6095,False,negative,0.9171,positive,0.5364,negative,0.6095
The issue of Xiaomi phones being overheated and bad battery life may be solved😯 The only shortcoming is the software. The global software is less stable and the updates are slower than Chinese version.😢 Then this phone is great except the price🥹,battery,Subjective,battery life,absa,N/A,,negative,0.7633,negative,0.615,negative,0.598,True,negative,0.7633,negative,0.615,negative,0.598
"the battery drain and the heating is not only in the 15 ultra but also the xiaomi 15, i've been using the xiaomi 15 for the past 12 days and i have recently seen the drain in the battery while using instagram or any social media apps, the drain on that too is 12% of battery per hour an -d at that rate the phone only lasts between 5-6 hours, i have also been facing a heating problems when i take pictures. I believe that these problems are not from the hardware but from hyperos 2.0, which they need to improve on to fix these problems on 15 series.",battery,Subjective,battery life,absa,N/A,,negative,0.9297,negative,0.8822,negative,0.7164,True,negative,0.9297,negative,0.8822,negative,0.7164
"Pffff it's so difficult when it comes to phones because camera wise the colour contrast is so good! Battery life I would say the Vivo X200 Pro is very solid, but camera wise more AI, so it depends on your needs and very different colour profile on pics. I have heard good things about the Oppo Find X8 Ultra but i think that's too early to tell atm maybe",battery,Subjective,battery life,absa,N/A,,positive,0.812,positive,0.7619,positive,0.8433,True,positive,0.812,positive,0.7619,positive,0.8433
I was thinking to upgrade my Xiaomi mi 11 ultra to this because I thought they've solved the heating and poor battery life issue. I guess I'll stick to my Mi 11 Ultra a bit more.,battery,Subjective,battery life,absa,N/A,,neutral,0.9493,neutral,0.8599,negative,0.7003,False,neutral,0.9493,neutral,0.8599,negative,0.7003
"Ente phone MI 11t pro 5g same problem vanu high battery draining ,over heating showroom il kaichapol motherboard issue nu paranju 2 days kazhinjo phone fully dead ayyi😢 MI yude highly common issue ayi ippo motherboard issue plz don't recommend MI redmi poco phones",battery,Subjective,battery life,absa,N/A,,negative,0.9906,negative,0.9772,negative,0.9728,True,negative,0.9906,negative,0.9772,negative,0.9728
​@svetllana92I was really stressed thinking this is only happening to me. I recently bought 15 Ultra but not though that 5400mah could drain that fast. I think I should have gone with vivo x200 pro 😢 the overall phone is good just the battery and heating is what they need to improve,battery,Subjective,battery life,absa,N/A,,negative,0.9651,negative,0.9433,negative,0.7865,True,negative,0.9651,negative,0.9433,negative,0.7865
One of the best camera mobile !! ❤️ Cant wait to test this more next month … only glitch is the battery drain .. Hope Xiaomi do something about it,battery,Subjective,battery life,absa,N/A,,positive,0.9127,positive,0.875,negative,0.9448,False,positive,0.9127,positive,0.875,negative,0.9448
Bro will you suggest best camera mobie Vivo x200 pro vs Xiaomi 15 ultra vs Samsung 25 ultra,camera,Subjective,photo and video quality,absa,N/A,,neutral,0.9912,neutral,0.9918,neutral,0.876,True,neutral,0.9912,neutral,0.9918,neutral,0.876
"Leica; so the Xiaomi 15 Ultra's ugly camera lenses are arranged in a L-shape. Xiaomi make some improvement to the software, HyperOS. It's now more power efficient which improved battery life. But, it cannot handle the Snapdragon 8 Elite very well and the video need some retweet. The same so-so selfie cam, no more variable aperture on the main camera to get the 200MP HP9 1/1.4"" sensor for the 100mm equivalent focal length or 4.3x periscope telephoto camera. In the end, I'd say that the Xiaomi 15 Ultra is an incredible camera phone.",camera,Subjective,photo and video quality,absa,N/A,,positive,0.7272,positive,0.6667,positive,0.6451,True,positive,0.7272,positive,0.6667,positive,0.6451
"Using Xiaomi 15 ultra for 2.5 months now. Not facing any battery issue till now(average use, CoC couple of times per day, YouTube etc.. mostly on wifi and not in mobile network.) and getting 1 day easily. Feels like there are some bugs. (WhatsApp videos getting stuck, black screen for YouTube, and OS restarted for one time) Curvature of curved display is not good as 1+(using 1+ also) Excellent photos(details and depth, especially when you check the photos taken in a 32inch or above display). Video in low light/ indoor feels to have some grains effect.(But not sure about what is the light intensity and what are the limits for a phone camera)",camera,Subjective,photo and video quality,absa,N/A,,positive,0.9445,positive,0.8562,positive,0.5413,True,positive,0.9445,positive,0.8562,positive,0.5413
"The Vivo X200 Ultra has a better wide camera, and from what I've seen, it does take somewhat better pictures. The Xiaomi 15 Ultra does better videos though. But I've read on multiple social media posts that it struggles with being consistent. Sometimes it takes excellent pics, but sometimes it puts out blurry pics.",camera,Subjective,photo and video quality,absa,N/A,,positive,0.6545,positive,0.6127,positive,0.4153,True,positive,0.6545,positive,0.6127,positive,0.4153
"I agree with you. Leica is known as a photography company (although their lenses are used by filmmakers). The Xiaomi 15 Ultra however is marketed for both stills and video as pointed out in the video 🙃. And yes — it indeed rocks for both stills and video (video thanks to third-party app). If/when Xiaomi update their camera app with key missing functionality restored in pro video mode, it will be just as good for video as it currently is for stills. Asking too much?",camera,Subjective,photo and video quality,absa,N/A,,positive,0.8263,positive,0.827,positive,0.6129,True,positive,0.8263,positive,0.827,positive,0.6129
Xiaomi 15 ultra and Vivo X200 pro detailed comparison video cheyyumo shazz bro? which is better,camera,Subjective,photo and video quality,absa,N/A,,neutral,0.7261,neutral,0.751,positive,0.9634,False,neutral,0.7261,neutral,0.751,positive,0.9634
But Xiaomi 15 ultra photos um YouTube I'll kandathil athara better aayi thonilla but ellarum parayunnu better details and camera specs also pro mode I'll xiaomi better ennu,camera,Subjective,photo and video quality,absa,N/A,,neutral,0.9281,neutral,0.8813,neutral,0.4993,True,neutral,0.9281,neutral,0.8813,neutral,0.4993
"I'm in the usa and i really want to give the Xiaomi 15 ultra or vivo's next x200 ultra a shot because id really love a top notch camera... however i also want a foldable, but i want top notch camera system...so I'm torn...",camera,Subjective,photo and video quality,absa,N/A,,positive,0.9215,positive,0.9099,positive,0.9654,True,positive,0.9215,positive,0.9099,positive,0.9654
Definitely It's a beat for Galaxy S25 Ultra and Vivo X200 pro Killer. Xiaomi 15 Ultra is the Number 1 camera Smartphone brand is now on. It's break the record on mobile Industries 📸🔥🔥🔥🔥🔥🔥. XIAOMI 15 ULTRA & XIAOMI SU7 ULTRA. Powered by Xiaomi HyperOS 2.2 🔥🔥🔥🔥😍,camera,Subjective,photo and video quality,absa,N/A,,positive,0.9428,positive,0.9237,positive,0.9998,True,positive,0.9428,positive,0.9237,positive,0.9998
