text,comment_category,final_subjectivity_label,aspect_input,pipeline,roberta_sentiment,roberta_confidence,deberta_base_sentiment,deberta_base_confidence,deberta_base_finetuned_sentiment,deberta_base_finetuned_confidence,deberta_large_sentiment,deberta_large_confidence,deberta_models_agree,final_base_sentiment,final_base_confidence,final_finetuned_sentiment,final_finetuned_confidence,final_large_sentiment,final_large_confidence
"Bro I’ve been using the OnePlus 9 Pro every day and I love this phone so much — it still works great and I haven’t had any problems, only the battery life is not good anymore. Now I want to upgrade and I like both the iPhone 17 and the Galaxy S26, but I can’t decide which one to buy. I watch Youtube and sometimes i play games i dont take pictures or zoom. I just want a fast phone. I think Iphone 17 is for me I dont like Exynos CPU is so bad compared to snapdragon",overall,Subjective,overall,overall,positive,0.9104,N/A,,N/A,,N/A,,,positive,0.9104,positive,0.9104,positive,0.9104
"Samsungs are just iphone clones with Samsung software now days, still on s10 plus because nothing good has come out to really make me want to upgrade, they got worse with no sd card slot!, no headphone jack (more manageable but still annoying), the flat screen ok I can live with but now shaped like bricks with rounded corners mehh, for a while downgraded from 1440 screens to 1080 lame! Finally have 1440 other than s26 base, I miss nice devices, I may upgrade just because my phone is so old but in some ways I feel like I'm downgradong especcialy in the feel in the hand category",overall,Subjective,overall,overall,negative,0.8295,N/A,,N/A,,N/A,,,negative,0.8295,negative,0.8295,negative,0.8295
"I was going to buy a phone and was waiting for a comparison between the s26 and I phone 17. As a galaxy user since the S3 got released, I think I will switch to I phone. The camera is overall better, I dont know how Samsung cannot catch up for so long. The only thing I wish I phone had was a better zoom but anyways, the I phone 17 is still worth the price this year according to me.",overall,Subjective,overall,overall,positive,0.7755,N/A,,N/A,,N/A,,,positive,0.7755,positive,0.7755,positive,0.7755
"Samsung has once again, for the 4th year in a row, left the baseline S26 and S26+ with the same camera hardware, no clear info on whether USB‑C 3.2 is supported, and only tiny battery upgrades. Yet the prices keep going up, for what, exactly? Even the S26 Ultra barely changed this year. At this point, I’m skipping Samsung phones for the fourth year straight. Brands like Oppo, Vivo, and Xiaomi are offering far better camera systems, performance, and design for the money.",overall,Subjective,overall,overall,negative,0.7383,N/A,,N/A,,N/A,,,negative,0.7383,negative,0.7383,negative,0.7383
"The S26 is a massive downgrade from the S25. It has become slightly bigger and heavier—an unnecessary change for what was a perfectly sized compact phone. Combined with those sharper edges, the ergonomics are jarring, making it much more uncomfortable to hold. ​We don't even need to mention moving back to Exynos from the S25's Snapdragon 8 Elite. When I compared them side-by-side, I noticed that even the display has been downgraded. It is dimmer than the S25 at full brightness, even though it doesn't even feature a privacy display. It’s likely the worst 'upgrade' we’ve seen from Samsung in years.",overall,Subjective,overall,overall,negative,0.8431,N/A,,N/A,,N/A,,,negative,0.8431,negative,0.8431,negative,0.8431
I'm more than happy with my s23 plus... I was tempted by the s26 as Samsung had to quiet a good trade-in and double storage offer but I'm really not bothered about all the AI crap,overall,Subjective,overall,overall,positive,0.9016,N/A,,N/A,,N/A,,,positive,0.9016,positive,0.9016,positive,0.9016
"I mean now what's the difference between s26 and 25... No change for customer. Why not choose chinese one plus, bigger battery, faster charging, better processor, bigger battery... Samsung and apple are just surviving because of protectionism and myopic loyal fan base stuck to ecosystem 😂😂😂",overall,Subjective,overall,overall,neutral,0.4552,N/A,,N/A,,N/A,,,neutral,0.4552,neutral,0.4552,neutral,0.4552
I have a Samsung Galaxy S25 looking at the new base S26 the only upgrade I see is the extra 300mAh in battery size. Which I can easily live without. I don't do mobile gaming or anything intensive so my smaller 4000mAh lasts me quite a while. Unless you are shooting fot fhe Ultras I see no point in upgrading at all.,overall,Subjective,overall,overall,neutral,0.575,N/A,,N/A,,N/A,,,neutral,0.575,neutral,0.575,neutral,0.575
"Same. S21 base model for me, I really want a S26 Ultra but I live in Korea so the phone market is pretty much fixed in Samsung's favor. Even previous models don't really get cheaper when new ones come out 😭 Gotta buy a used one directly from someone and hope they didn't abuse the battery too much if you want to buy an older one for a decent price",overall,Subjective,overall,overall,neutral,0.3961,N/A,,N/A,,N/A,,,neutral,0.3961,neutral,0.3961,neutral,0.3961
the regular S26 and + are the same phone as the last 3 years. not even close to worth the money. The ultra went back to aluminum because apple did. samsung just copies anything and everything apple does. buy a Pixel 10 pro and ignore these devices,overall,Subjective,overall,overall,negative,0.766,N/A,,N/A,,N/A,,,negative,0.766,negative,0.766,negative,0.766
"Nonsense. It is easy to compare S25 vs S26, or even S22 vs S26 and say ""Samsung is slacking"", but ask what the hell the competition is doing at the same time? iPhone 17 - 120Hz! Finally! YAY! But still uses USB 2.0, still charges at 25 Watts, still has a dual-camera setup. Hardware-wise, that is not even on-par with the Galaxy S20 from 2020, which had 120Hz, USB 3.0, 45-Watt charging and a 3-camera setup with 8K ability! Pixel 10 is far more competitive, especially the new 5x Zoom lens, but let's not forget that the Tenor G5 is only on-par with the Snapdragon 8 Gen 2 from Galaxy S23 series! Samsung is slacking because of 0 competition.",overall,Subjective,overall,overall,neutral,0.3991,N/A,,N/A,,N/A,,,neutral,0.3991,neutral,0.3991,neutral,0.3991
"S23 ultra got mother board issue, I am going for s26 base. Is it good or should I swich from samsung as having issues now a days with samsung in rising trend? Plz suggest.",overall,Subjective,overall,overall,negative,0.481,N/A,,N/A,,N/A,,,negative,0.481,negative,0.481,negative,0.481
How is the the S26 base model awful when everyone is praising the base model iPhone 17 even saying ridiculous shit like it's the phone to buy phone of the year are folks crazy...lol are are so we just have very low expectations for apple and much much higher expectations for samsung and Google I'm sick of this ish,overall,Subjective,overall,overall,negative,0.8564,N/A,,N/A,,N/A,,,negative,0.8564,negative,0.8564,negative,0.8564
"Samsung is a good JOKE on customers. And no one has done it better than comparing the classic s26 and s26+ 😅 Let Samsung shareholders get pissed off, I'll sell the s24 ultra and buy the Xiaomi 17 Ultra, when they understand that this can't be done indefinitely and at least get closer to today's top, unfortunately mainly from China, I might consider something called Samsung.✌",overall,Subjective,overall,overall,negative,0.6903,N/A,,N/A,,N/A,,,negative,0.6903,negative,0.6903,negative,0.6903
"I've been debating pre-ordering the s26 ultra the last several days, but no more. Yesterday i was browsing my local fb marketplace and picked up a basically new condition Z Fold 7 1TB model for $900 and trading a iphone 14 pro for it, i just grabbed the iphone the other day, soley to see what iOS 26 was all about. Always been diehard galaxy S series user. No surprise I still dont like iOS. And coming from a S24 the z fold 7 is amazing.",overall,Subjective,overall,overall,neutral,0.621,N/A,,N/A,,N/A,,,neutral,0.621,neutral,0.621,neutral,0.621
"Current Base S20 user here. Finally upgrading to a base S26 and it feels awful. I need a new phone, as 5 years of daily wear and tear has caught up. However, im losing my 2k display. Losing my SD card slot. And all im getting is a moderate processor upgrade, a small RAM bump, and thats it. Also annoyed they bumped the size to 6.3"" but ill live with it. Same wireless charging wattage. At least im technically getting a camera upgrade. Still feels like a sideways move instead of an actual upgrade. Almost 6 years later, which is laughable.",overall,Subjective,overall,overall,negative,0.861,N/A,,N/A,,N/A,,,negative,0.861,negative,0.861,negative,0.861
"Hi, first of all, congratulations on your channel! Could you tell me if you've noticed any overheating in the device during normal use (I don't use it for gaming), and/or when using 5G mobile data, or performing any specific tasks? And what do you think the battery consumption is like compared to the S25 with Snapdragon? I need to change my phone and I'm torn between the S26 Exynos and the S25 Snapdragon. My main concerns, as I mentioned, are about device overheating (did Samsung fix the Exynos heat issues?) and battery consumption, since it has an external modem. What do you think? Thanks.",overall,Subjective,overall,overall,neutral,0.7063,N/A,,N/A,,N/A,,,neutral,0.7063,neutral,0.7063,neutral,0.7063
Mike you're being way too kind with the s26 looks like a total dud probably the only people who should upgrade maybe if you have an s20 or an S21 but besides that it's the same phone since the s22 except with a newer processor.,overall,Subjective,overall,overall,negative,0.8817,N/A,,N/A,,N/A,,,negative,0.8817,negative,0.8817,negative,0.8817
I did the same thing im on the s21 ultra and I got the s26 ultra its a big enough leap to be worth it for me. Also my phone now its a bit buggy occasionally and battery is wonky on it,overall,Subjective,overall,overall,positive,0.4695,N/A,,N/A,,N/A,,,positive,0.4695,positive,0.4695,positive,0.4695
"Unfortunately, therein lies the problem. They put all of their little bit of effort into the s26 ultra. It's the Apple ladder pricing scheme again. Samsung has stopped innovating, and so has Apple",overall,Subjective,overall,overall,negative,0.8282,N/A,,N/A,,N/A,,,negative,0.8282,negative,0.8282,negative,0.8282
"I have an S23 Ultra. S26 Ultra would be a downgrade as I'd lose the curved edge, 10x telephoto camera, and S-Pen remote camera shutter button. Sure it has a faster processor. But I don't game on my phone and would never notice the difference. Sure it has a advanced privacy screen feature, but regular viewing angles are worse. Etc. Hopefully they change something for the better someday.",overall,Subjective,overall,overall,neutral,0.4499,N/A,,N/A,,N/A,,,neutral,0.4499,neutral,0.4499,neutral,0.4499
I have been using S22 Ultra for 4 years now. What a beast of a phone. Not a single problem till date. But its time for an upgrade. Waiting for my S26 to be delivered,overall,Subjective,overall,overall,positive,0.9388,N/A,,N/A,,N/A,,,positive,0.9388,positive,0.9388,positive,0.9388
@isiterrorits definitely better than the s25 in camera and battery. Dont know about the s26 but it is cheaper than the s26 so there is that.,overall,Subjective,overall,overall,positive,0.9056,N/A,,N/A,,N/A,,,positive,0.9056,positive,0.9056,positive,0.9056
I am trying to buy a new phone nothing wrong with my 4 yr old s22 but it's battery has start to hurt my day to day task but the UI and everything feels sad on the s26 like nothing has changed the past 4 years,overall,Subjective,overall,overall,negative,0.8475,N/A,,N/A,,N/A,,,negative,0.8475,negative,0.8475,negative,0.8475
"@sudewsanu now thats some grade A bs, the iphone 17 has 2 flagship sensors as well as anti reflective coating, faster charging, mag safe and centre stage, compare that to the S26’s 4 year old cameras first seen on the S22, slower charging, worse display ect and the 17 costs $100 less then the S26",overall,Subjective,overall,overall,negative,0.7578,N/A,,N/A,,N/A,,,negative,0.7578,negative,0.7578,negative,0.7578
"Hmm I agree... S26 has a unusual reddish tone in photos, which I don't like but videography of s26 is better than x300... I'm a part time photographer and I click zoomed shots more , so for me x300 is a better choice... I'm planning for x300 ... Cam is good according to the price",overall,Subjective,overall,overall,neutral,0.4335,N/A,,N/A,,N/A,,,neutral,0.4335,neutral,0.4335,neutral,0.4335
"The Exynos 2200 in the S22 is very inefficent. Maybe one of the most inefficent one in the S-Series. And the battery is 600mah smaller. That's why I switch from the S22 to the S26. And I guess the NPU ist muss faster. In Sony APS-C cameras the sensors didn't improve for years, but the processors behind made a big difference. Better White balance, a way better Auto focus and face detection and an better automatic modus, when you want to take a snapshot from children or animals. When you are just shouting landscapes with no movement and good conditions then you don't see a difference.",overall,Subjective,overall,overall,negative,0.6414,N/A,,N/A,,N/A,,,negative,0.6414,negative,0.6414,negative,0.6414
I will buy the s26 plus maybe in 2028 when its cheaper but i really dont like having an ai baby sitter inside my phone 😊,overall,Subjective,overall,overall,negative,0.5447,N/A,,N/A,,N/A,,,negative,0.5447,negative,0.5447,negative,0.5447
S22 Ultra - S26 Ultra. All i see is new chipset and privacy gimmick. If Samsung had at least upgraded to a bigger battery this years phone would be kinda okay.,overall,Subjective,overall,overall,neutral,0.4935,N/A,,N/A,,N/A,,,neutral,0.4935,neutral,0.4935,neutral,0.4935
"Coming from galaxy a55. The only one i can afford is the s26 base. Its making me feel bad since I already preorder the base model, but has hearing lot of negatives. Hahays.",overall,Subjective,overall,overall,negative,0.8851,N/A,,N/A,,N/A,,,negative,0.8851,negative,0.8851,negative,0.8851
Even though i'm a Samsung user since long time. I'm really disappointed with S25 and S26 series. Apple cooked with iphone 17 this year. Bravo Apple 👏 gonna stick with my S24 ultra. Samsung's last real ultra model. 💪,overall,Subjective,overall,overall,positive,0.4125,N/A,,N/A,,N/A,,,positive,0.4125,positive,0.4125,positive,0.4125
"Hmm yes S26 is not amazing for portraits, iphone 17 often is better. Overall I think some other older phones had better results in terms of non-oversharpened natural look. Yet we probably expect a from phones these days. Would love to see more video tests as well as panning tests.",overall,Subjective,overall,overall,negative,0.6467,N/A,,N/A,,N/A,,,negative,0.6467,negative,0.6467,negative,0.6467
Samsung was a prestige phone brand years ago everyone wanted to get hands on their phones shame that they left their costumers for AI and s26/s26+ including other years before they didn't give samsung any money that's way they ditched snapdragon to other regions to cut costs and with 100 dollars more they now will have 0 sales,overall,Subjective,overall,overall,negative,0.6763,N/A,,N/A,,N/A,,,negative,0.6763,negative,0.6763,negative,0.6763
"​@Lemonade_Stand_yeah, I would definitely go to Best Buy and take a look. But i'm pretty sure if you watch the reviews, the cameras are exactly the same as the 25+ and the battery hasn't increased at all on the plus model... Now the base S26 has a larger battery than the S25 ...So that one's increased a little bit.",overall,Subjective,overall,overall,positive,0.499,N/A,,N/A,,N/A,,,positive,0.499,positive,0.499,positive,0.499
​@jejunamjai also might look at the google pixel.. ive been hearing good things about that one too. Ill probably wait a few weeks for more reviews and comparisons to come out for the s26. My S21 is still fine for the most part (battery could be better but it's not terrible) so im not in a huge rush. I appreciate your input.,overall,Subjective,overall,overall,positive,0.8837,N/A,,N/A,,N/A,,,positive,0.8837,positive,0.8837,positive,0.8837
"Same. I'm older but even if I was still in my early 20s I wouldn't see a justifiable reason to upgrade my phone till it dies. I'm gonnna replace the battery soonish for ~$20 and ride this for another 2-3 years. Then I might buy a used/good condition s26 or s27 for 1/3 of the price, like how I did with my s21.",overall,Subjective,overall,overall,negative,0.5052,N/A,,N/A,,N/A,,,negative,0.5052,negative,0.5052,negative,0.5052
"Im switching from an s20+ 5G 512GB to s26+ 5G 512GB . Ive changed the battery once but it is still a great phone. The only issue I had was screen burn from youtube and the top bar with time/battery/signal etc.. its permanently burned into screen. Im sure I will enjoy the newer experience, as ive not had the 21 to 25 series",overall,Subjective,overall,overall,positive,0.8869,N/A,,N/A,,N/A,,,positive,0.8869,positive,0.8869,positive,0.8869
"Okay this is super useful, for ages I've been stuck with a Chinese cheap brand phone and it's been driving me insane of how awful it works and this video helped me to make comparisons between the s25 and s26 so I can buy one and since I'm more of a specs guy that's more or less all what I mostly care about, I'm even considering getting the plus version if the battery is better",overall,Subjective,overall,overall,positive,0.5931,N/A,,N/A,,N/A,,,positive,0.5931,positive,0.5931,positive,0.5931
Kind of funny they made the s26 bigger then s25 and the reason people bought the base model yes one cuz it was the cheapest but cuz it was a smallish phone but even that isn't quite what it used to be. I don't think anybody should buy the s26 you should just buy the s25 save a whole bunch of money i hope the s26 is their worst selling phone ever and so Samsung gets the hint.,overall,Subjective,overall,overall,negative,0.4624,N/A,,N/A,,N/A,,,negative,0.4624,negative,0.4624,negative,0.4624
"​@curist8411 I ended up taking advantage of the deal through AT&T since they were offering $900 for my S20. So I have an S26 Ultra en route to my house. I hate to part ways with my 20, it's been a damn good phone to me for the last 6 years, but the battery life and performance are starting to show some age and the deal was too good to pass up. I plan on having the S26 for at least the next 6 just like this one!",overall,Subjective,overall,overall,positive,0.812,N/A,,N/A,,N/A,,,positive,0.812,positive,0.812,positive,0.812
"The only upgrade the base S26 got is a larger storage amount of 512 GB. While I'm glad a smaller phone is getting more storage that isn't a Pixel, it definitely needs more. And admittedly that's the reason why I'm getting one. Tried a number of different phones and each had their quirks I couldn't get past. (Pixel devices have this obnoxiously large camera bump making any case unable to protect said camera, and my S25 Plus was so damn huge) The S26 is still a good device but way too fricken expensive for what it offers.",overall,Subjective,overall,overall,neutral,0.3917,N/A,,N/A,,N/A,,,neutral,0.3917,neutral,0.3917,neutral,0.3917
"Thanks for checking out my Samsung S26 review, you're smashing you are. Not had a great time with it so far, but here's hoping some OTAs can sort out some of these problems soon - I'll certainly try and revisit it in another month or two. For now, let us know your thoughts below, and have a lovely day xx",overall,Subjective,overall,overall,positive,0.9021,N/A,,N/A,,N/A,,,positive,0.9021,positive,0.9021,positive,0.9021
"I currently own S23. S26 with a bigger size and negligible battery upgrade, is absurd. Will shift to one plus or vivo.",overall,Subjective,overall,overall,negative,0.7533,N/A,,N/A,,N/A,,,negative,0.7533,negative,0.7533,negative,0.7533
Samsung s26 is perfect full package and I feel is better than the ultra,overall,Subjective,overall,overall,positive,0.9765,N/A,,N/A,,N/A,,,positive,0.9765,positive,0.9765,positive,0.9765
"Base mode galaxy s26 is using 100% the same old camera from s23,24 and s25.",overall,Subjective,overall,overall,neutral,0.8054,N/A,,N/A,,N/A,,,neutral,0.8054,neutral,0.8054,neutral,0.8054
"@Judas410 the heavy still same to reguler series, just 162-167 gram between S25 reguler & S26 reguler ,,, add more 300 mah battery, still acceptable, but camera hardware ? well, need more upgrade.",overall,Subjective,overall,overall,neutral,0.6809,N/A,,N/A,,N/A,,,neutral,0.6809,neutral,0.6809,neutral,0.6809
"@eruno_ The thing is though, back then phones above 5.5 inch or above feel like phablets because they're wide and big, but a lot of the front is occupied by bezels. Now every new phone is pretty much bezel-less and taller (instead of wider) so the compact phones of today is almost similar to compact phones of old. The base iPhone 7 dimensions is 138.3 x 67.1 x 7.1 mm. Meanwhile, the base S26 is 149.6 x 71.7 x 7.2 mm. That's a 11mm increase on length while the screen is 1.6 inches larger. I have the base S25 and my dad still has the old iPhone 7, and barely noticed the physical size difference.",overall,Subjective,overall,overall,neutral,0.7131,N/A,,N/A,,N/A,,,neutral,0.7131,neutral,0.7131,neutral,0.7131
It was originally “My problem with the Samsung s26 ultra”😂 I see you Austin 😅,overall,Subjective,overall,overall,neutral,0.6403,N/A,,N/A,,N/A,,,neutral,0.6403,neutral,0.6403,neutral,0.6403
"I just pre-ordered a Galaxy S26 Ultra, and I'm getting even more excited after hearing this good news. The only problem I have now is which case to buy. Can you guys recommend a good case other than Samsung's official cases? Thanks",overall,Subjective,overall,overall,positive,0.9655,N/A,,N/A,,N/A,,,positive,0.9655,positive,0.9655,positive,0.9655
"​@darshan6505 same thing in the 17 pro max twin. a bigger battery compared to the 16 pro max. But in the s26 ultra it's not just the privacy screen though. Ai, camera, software improvements also included. The camera stabilization is so good that you can literally turn your phone 360° and your video will remain stable asf. Can your iPhone do these?",overall,Subjective,overall,overall,positive,0.7491,N/A,,N/A,,N/A,,,positive,0.7491,positive,0.7491,positive,0.7491
I switched from an S24 Ultra to a Vivo X200 Pro (end of 2024 phone) and man I'm still impressed both by the cam quality and also the battery life. My X200 Pro to the day still yakes better photos than the iPhone 17 Pro Max AND the S26 Ultra. And the video is not far behind to be honest. That Zeiss color science is UFF 🔥🔥🔥,overall,Subjective,overall,overall,positive,0.9686,N/A,,N/A,,N/A,,,positive,0.9686,positive,0.9686,positive,0.9686
I use Samsung from Galaxy S 3G 2012 and still work to now . Just can not download any from google no more and battery 25 mins too heheheh And the S26 Ultra look like S26+ that's what you see missing there buddy . I'm waiting for them to bring back my Galaxy Note or I'll won't buy any phone but Samsung Tablet because Samsung Dex very useful .,overall,Subjective,overall,overall,positive,0.5087,N/A,,N/A,,N/A,,,positive,0.5087,positive,0.5087,positive,0.5087
"So the s26 ultra is more of a camera Phone than a normal regular business phone ? This is the more reason the iPhone users are just mocking us. Every advert i see about the s26 ultra is all about privacy screen and camera.. Can't we just think of a better way to promote this s26 ultra for goodness sake.. it's just pissing me off the way u guys is just hyping this phone. Anyways, I m still rocking my s25 ultra",overall,Subjective,overall,overall,negative,0.7488,N/A,,N/A,,N/A,,,negative,0.7488,negative,0.7488,negative,0.7488
"I have a major question, and I need an honest answer soon, please. My iPhone 7 broke down two days ago, and it’s not worth the money to repair it. I started looking into phones, but I’m so overwhelmed by all the choices. However, I’ve narrowed it down to a few options: the Samsung S26 Ultra, the S25 Ultra, the S26+, the iPhone 17, 17 Pro, 17 Pro Max, or any Google phone (even though I don’t really like the design. Still, they seem to have really powerful AI). Does anyone know which would be the right option to buy? Thanks in advance.",overall,Subjective,overall,overall,negative,0.6305,N/A,,N/A,,N/A,,,negative,0.6305,negative,0.6305,negative,0.6305
"Still in love with my S24 Ultra... I thought the S26 Ultra was going to be when I wanted to upgrade, but nah. Yeah, I'm a sucker for performance, but the S24 Ultra is still flying. Loving the camera too. And one more thing I love about my S24 Ultra is your review on it... no other Ultra has deserved that kind of review this year. Why buy another phone? Still two years later (at least why buy another Samsung Ultra, right?)",overall,Subjective,overall,overall,positive,0.9469,N/A,,N/A,,N/A,,,positive,0.9469,positive,0.9469,positive,0.9469
He's actually making the point for why you shouldn't buy the s26 ultra. If you can't notice any differences besides the washed out privacy screen then what's the point. Samsung makes 10-bit screens for other OEMs but not for their own $1400 devices?? I'm holding on to my S24 ultra. When that's done I'll think about Vivo or Xiaomi!!!... And yes I'm still bitter about removing the Bluetooth spen and charging the same or more!!!,overall,Subjective,overall,overall,negative,0.521,N/A,,N/A,,N/A,,,negative,0.521,negative,0.521,negative,0.521
