text,comment_category,final_subjectivity_label,aspect_input,pipeline,roberta_sentiment,roberta_confidence,deberta_base_sentiment,deberta_base_confidence,deberta_base_finetuned_sentiment,deberta_base_finetuned_confidence,deberta_large_sentiment,deberta_large_confidence,deberta_models_agree,final_base_sentiment,final_base_confidence,final_finetuned_sentiment,final_finetuned_confidence,final_large_sentiment,final_large_confidence
Pixel 10 user here. 2 days of battery life. Everything quick. No gaming. Love that phone. Had iPhones. Came from galaxy. Hope the quality is better. Overall my best phone so far.,battery,Subjective,battery life,absa,N/A,,positive,0.9218,positive,0.8961,positive,0.9998,True,positive,0.9218,positive,0.8961,positive,0.9998
"That’s the thing, everyone has a different experience due to poor QC from Google, the next 3 people with a pixel 10 Pro, probably has their phone dead by 5 pm, the next has good battery life. Either have consistency or lose the trust of customers, like myself.",battery,Subjective,battery life,absa,N/A,,negative,0.6813,negative,0.6724,neutral,0.6551,False,negative,0.6813,negative,0.6724,neutral,0.6551
@TechOdyssey hey how you doing Question is the Google Pixel 10 battery swappable to Google 9 bc this battery is horrible I've been using this phone since last year October the first 3-4 months Was Good battery But Now the phone drains Fast battery drains even when im not using it.,battery,Subjective,battery life,absa,N/A,,negative,0.9187,negative,0.845,negative,0.9937,True,negative,0.9187,negative,0.845,negative,0.9937
"Good to know...I preordered Pixel 10 pro and was disappointed by the battery life. Went and bought an iphone 17 but haven't set it up yet, been like 10 days lol. Been on Android since iphone 6 and nervous to switch. It is reassuring to hear your experience with iPhone has been better battery life. Other than the battery, how has your overall experience been?",battery,Subjective,battery life,absa,N/A,,positive,0.9671,positive,0.9417,positive,0.5905,True,positive,0.9671,positive,0.9417,positive,0.5905
I'm quite happy with my Pixel 10. Performance is enough for what I do and I get a day and a half easily of battery life. I guess charging speed could be a bit faster but other than that it's a great upgrade from my 6 year old phone.,battery,Subjective,battery life,absa,N/A,,positive,0.9535,positive,0.9347,positive,0.9989,True,positive,0.9535,positive,0.9347,positive,0.9989
"I've had my Pixel 10 for like 3 weeks now and I love it lol. Display is great, battery life is really good, cameras amazing as always, and Pixel still has some of the best haptics on any phone. Definitely my favorite phone I've used in a long time",battery,Subjective,battery life,absa,N/A,,positive,0.9929,positive,0.983,positive,0.9995,True,positive,0.9929,positive,0.983,positive,0.9995
"Appreciate the honest review. I'm an unabashed Pixel fan. Currently on a Pixel 6 that's been a very solid phone, still going pretty strong (except for awful battery life) and was going to upgrade to a Pixel 10. The more reviews I see, the more I think I'm going to hold out until the Pixel 11. Or maybe buy a 10 when it's on a sale at a very good price.",battery,Subjective,battery life,absa,N/A,,negative,0.7182,positive,0.6664,negative,0.5,False,negative,0.7182,positive,0.6664,negative,0.5
I'm very happy with my pixel 10 pro XL so far. I'm sure there's better battery out there and it's not a phone for gamers but it's great for me,battery,Subjective,battery life,absa,N/A,,positive,0.9905,positive,0.9763,positive,0.5093,True,positive,0.9905,positive,0.9763,positive,0.5093
At my job on a good day i drain my phone from 100% then use up a 10k battery bank. Then get home on 40-50%. sounds like i'm screwed if I buy a pixel 10 pro,battery,Subjective,battery life,absa,N/A,,negative,0.5955,negative,0.7206,neutral,0.935,False,negative,0.5955,negative,0.7206,neutral,0.935
"Weird, my pixel 10 is better with battery life than my 9. The same with my 10 pro xl vs my 9 pro xl. I can get 61/2 to 8hrs of sot with my 10xl, while my 9xl can barely get over 5hrs.",battery,Subjective,battery life,absa,N/A,,positive,0.7687,positive,0.6322,neutral,0.8773,False,positive,0.7687,positive,0.6322,neutral,0.8773
"Pixel 10... AI crippled in Portugal and with a mid-range chipset, small battery and probably the slowest charging on the market, Gorilla Glass body from 2022, power management and overheating issues, main camera worse than the Pixel 6 (from 4 generations ago)... did I forget anything?",battery,Subjective,battery life,absa,N/A,,negative,0.6824,negative,0.8205,negative,0.9952,True,negative,0.6824,negative,0.8205,negative,0.9952
"I really like my pixel 10 pro xl, the jade green was a huge selling point besides the phone just having better specs. I think the battery life is really good i don’t use my phone constantly or play video games on it. I do watch YouTube once in a while and text mainly and it gets like 1.5 days for me usually.",battery,Subjective,battery life,absa,N/A,,positive,0.9544,positive,0.9049,positive,0.9988,True,positive,0.9544,positive,0.9049,positive,0.9988
"I truly miss my Vanilla ice cream🍦...I literally can watch my battery drain and I'm no power user by any means. No games, some IG or YouTube while on WiFi and the battery drain is insanely terrible. I contacted Verizon and they are sending me another Pixel 10 XL pro because they felt my phone is defective as well. On the call with them my battery drained 10 percent. Glad to know I'm not the only one but I hate that we're dealing with this...",battery,Subjective,battery life,absa,N/A,,negative,0.9184,negative,0.9139,negative,0.8979,True,negative,0.9184,negative,0.9139,negative,0.8979
Strange. I went from S25U to Pixel 10 Pro XL and as I am using both devices in same way I am regulary able to get more from battery from pixel than from galaxy...,battery,Subjective,battery life,absa,N/A,,positive,0.7736,negative,0.4287,positive,0.9473,False,positive,0.7736,negative,0.4287,positive,0.9473
"Was waiting for this review I have black pixel 9, I love the blue color of the pixel 10 it's striking. I would have just upgraded for particularly 4 things 1. Telephoto lens 2. Better thermals and bigger battery (almost 5k mah) 3. Better top speaker. 4. And the best blue color I got the pixel 9 just 6 months ago so I would want to use it for another 2-3 years.",battery,Subjective,battery life,absa,N/A,,positive,0.8579,positive,0.867,positive,0.8023,True,positive,0.8579,positive,0.867,positive,0.8023
"The biggest tech company in the world... After 10 revisions, the Pixel 10 series still has the worst battery life.",battery,Subjective,battery life,absa,N/A,,negative,0.9907,negative,0.9743,negative,0.9562,True,negative,0.9907,negative,0.9743,negative,0.9562
"Hey, do you think the Pixel 10 would be a worthy upgrade over the Pixel 7? I've been using the 7 in the past 3 years and it's still going strong overall, maybe the battery life is a bit bad on heavy usage days with lots of GPS, Roaming etc.",battery,Subjective,battery life,absa,N/A,,negative,0.7483,neutral,0.4759,negative,0.6894,False,negative,0.7483,neutral,0.4759,negative,0.6894
"Google ripping off customers with the Pixel 10 💀 Battery, thermals, charging speed = shit",battery,Subjective,battery life,absa,N/A,,negative,0.9794,negative,0.944,negative,0.9942,True,negative,0.9794,negative,0.944,negative,0.9942
Thanks for addressing this. I've experienced 3-5% drops in battery just from opening camera and snapping a couple pictures sometimes. It will sit at a percentage for awhile and like a game of catchup the battery drops large percentage points at once. I'm glad google listens to feedback and i'm sure will address the issues from the initial launch as always. Pixel phones get better with every update from my experience so i'm not at all worried. On a 10 pro coming from an 8 which felt like it had much better and consistent battery life.,battery,Subjective,battery life,absa,N/A,,negative,0.7282,negative,0.686,positive,0.5876,False,negative,0.7282,negative,0.686,positive,0.5876
"I primarily use the main camera, so I prefer a mid-range phone that focuses on that rather than spec-chasing for marketing to those unfamiliar with their purchase. The Pixel 10 is a base flagship, so these downgrades are telling and an easy pass. It is a weird decision by Google, and I can only assume that with the S25 and even mid-range phones now offering a poor zoom camera (or old, viz the S25), the Pixel team decided to make this move. Bad mistake; if people want a zoom, they will pay the extra for the Pro model.",camera,Subjective,photo and video quality,absa,N/A,,negative,0.9717,negative,0.929,negative,0.8202,True,negative,0.9717,negative,0.929,negative,0.8202
I got here after I watched another video with Google Pixel 10 being crushed by Xiaomi 15T Pro (significantly lower priced mid-range phone) with superb specs and camera. I can't believe I was actually rooting for Pixel 10 and it's actually not a good buy. LOL I was really wanted them to be a better brand than Apple or Samsung. I GUESS NOT,camera,Subjective,photo and video quality,absa,N/A,,negative,0.5434,negative,0.6059,neutral,0.4892,False,negative,0.5434,negative,0.6059,neutral,0.4892
"Strange, I bought the Pixel 10 about a month ago, coming from Samsung S24, and after one month I really get frustrated with the Google Phone. Issues such as not be able to clear recent files without deleting them (and did try all published suggestions), video cam not be able to switch between front and rear while recording, suddenly powering off...I'm pretty bad disappointed I changed the Samsung for Pixel.",camera,Subjective,photo and video quality,absa,N/A,,negative,0.9454,negative,0.9254,negative,0.7231,True,negative,0.9454,negative,0.9254,negative,0.7231
"It's refreshing to see a camera review where it doesn't harp on megapixels and photography. Even the video quality. We are not all content creators, vloggers, and photography enthusiasts. Most phones today will satisfactorily shoot photos and video quite nice. Is the iPhone better at video? Yes. But videos on my Pixel 10 Pro aren't terrible by any measure. It captures my memories and things I want to record absolutely fine.",camera,Subjective,photo and video quality,absa,N/A,,positive,0.8995,positive,0.8094,neutral,0.5253,False,positive,0.8995,positive,0.8094,neutral,0.5253
"Thanks! Yeah, I agree - it's a good opportunity to save a load of money and still get a really solid camera system (better than the Pixel 10 in a lot of ways!). Cheers for the comment! 😁",camera,Subjective,photo and video quality,absa,N/A,,positive,0.7391,positive,0.8059,positive,0.923,True,positive,0.7391,positive,0.8059,positive,0.923
Pixel 10 Pro is the first phone to unlock 12-bit RAW DCG video recording. I'd say that's pretty amazing camera tech if you ask me! 😎,camera,Subjective,photo and video quality,absa,N/A,,positive,0.8505,positive,0.884,positive,0.9899,True,positive,0.8505,positive,0.884,positive,0.9899
The main and UW sensors are clearly much better on the Pixel 9 resulting in better videos and photos especially in low-light. The Pixel 10 has better zoom and portrait edge detection.,camera,Subjective,photo and video quality,absa,N/A,,positive,0.9789,positive,0.984,positive,0.9986,True,positive,0.9789,positive,0.984,positive,0.9986
"I don't want to sound like an apologist, as I have had years of use with the larger OG Tensor Pixel sensor, and have already noticed the downgrade on shots in challenging lighting conditions, but I am loving the Pixel 10's camera experience. I use the ultrawide once every 100 shots, so that sensor's devolution is inconsequential to me. The main takes great pictures in all but extreme conditions, and a decent 5x telephoto on a base model is a game changer (for me). The video is the thing that is lesser in a way that I have no retort to, but I don't think that video is bad. The classic sensor just takes immediately noticeably better video.",camera,Subjective,photo and video quality,absa,N/A,,negative,0.7821,negative,0.5285,positive,0.6166,False,negative,0.7821,negative,0.5285,positive,0.6166
Been waiting for this video! ❤ I can’t decide between the Pixel 10 or Xiaomi 15T Pro. Are you going to review that phone anytime soon? 🥹,camera,Subjective,photo and video quality,absa,N/A,,positive,0.7175,positive,0.6491,positive,0.6128,True,positive,0.7175,positive,0.6491,positive,0.6128
"While the iPhone 16 Pro's new photographic styles offer a unique perspective, they don't quite hit the mark. They provide more flexibility, but their straight-out-of-camera quality falls short compared to the Pixel 10 Pro, which requires no editing. The Amber Photographic Styles is no where near the Pixel color profile. They are simply glorify filters.",camera,Subjective,photo and video quality,absa,N/A,,positive,0.5853,positive,0.5723,negative,0.6616,False,positive,0.5853,positive,0.5723,negative,0.6616
Thanks! Very interesting … Are you sure that the photos of the black rabbit aren’t mixed up? Because the Pixel 10 is darker here but brighter in all other photos. It’s really a shame that Google downgraded the man camera sensor,camera,Subjective,photo and video quality,absa,N/A,,positive,0.9252,positive,0.897,positive,0.7812,True,positive,0.9252,positive,0.897,positive,0.7812
"​@DiamondMaster115your comment is so wrong it hurts. The processing in the Pixel 10 is so much better than the processing in the Pixel 9, that it makes up for a sensor with half the area? That would be revolutionary, and would mean that the 10 Pro with the same sensor as the Pixel 9 Pro should be better by a WIDE margin - and yet there's little discernable difference from the comparisons I've seen. Such a false statement, why make it?",camera,Subjective,photo and video quality,absa,N/A,,negative,0.8086,negative,0.6411,neutral,0.3547,False,negative,0.8086,negative,0.6411,neutral,0.3547
"I'm getting 13 hours of screentime on my pixel 10 with camera, social media apps, browsing and casual gaming. There is no heat at all in everyday tasks. My phone max temperature if you are outdoors under sunlight is 39°C. Don't just take one guy opinion and judge. It's a good phone for everyday task. Ofcourse the camera hardware is disappointing but only if you are upgrading from Pixel 9 series. I upgraded from P3a XL and it's fast, smooth, camera produces more accurate colors and sharp. Wireless charging with magsafe is nice add-on.",charging,Subjective,charging,absa,N/A,,positive,0.9226,positive,0.9135,negative,0.4863,False,positive,0.9226,positive,0.9135,negative,0.4863
"pixel 10 pro xl has either ""adaptive charging"" or ""limit to 80%"".... which is the best option to choose?",charging,Subjective,charging,absa,N/A,,neutral,0.769,neutral,0.7733,neutral,0.9971,True,neutral,0.769,neutral,0.7733,neutral,0.9971
"I bought the pixel 10 pro XL, and pro 10 fold, and was charging the pro fold the other day on wireless charging pad - A Certified Qi2 wireless charger and the phone froze up with the Google -G- stuck in the middle of the screen - and I'm pissed I didn't take a picture of it. It was real hot and didn't cool down after I took it off the charger. Only when I opened it up - did it cool down... overnight... then battery level was at zero... So I charged it up and now want to get rid of it...",charging,Subjective,charging,absa,N/A,,negative,0.5707,negative,0.5411,negative,0.8087,True,negative,0.5707,negative,0.5411,negative,0.8087
"I bought the pixel 10 pro XL, and pro 10 fold, and was charging the pro fold the other day on wireless charging pad - A Certified Qi2 wireless charger and the phone froze up with the Google G stuck in the middle of the screen - and I'm pissed I didn't take a picture of it. It was real hot and didn't cool down after I took it off the charger. Only when I opened it up - did it cool down... overnight... then battery level was at zero... So I charged it up and now want to get rid of it...",charging,Subjective,charging,absa,N/A,,negative,0.5955,negative,0.5553,negative,0.6798,True,negative,0.5955,negative,0.5553,negative,0.6798
Good work but I score 9 : 9 😊 In most pictures the Pixel 9 have the better colours and the Pixel 10 have a small problem with overlighting the pictures what the Pixel 9 don `t have !!,design,Subjective,phone design,absa,N/A,,positive,0.9117,positive,0.9421,positive,0.9503,True,positive,0.9117,positive,0.9421,positive,0.9503
Look I wouldn't buy the Pixel 10 and I don't recommend it but I would take it over the iPhone 17 because iPhone doesn't let me use Firefox with uBlock origin or any meaningful extensions at all or any browsers that aren't based on web kit. iPhones are just not good for a power user because they don't let you do anything.,design,Subjective,phone design,absa,N/A,,negative,0.9091,negative,0.8383,neutral,0.6861,False,negative,0.9091,negative,0.8383,neutral,0.6861
"Personally, I'd LOVE to see a smartphone offered that uses the 3:2 form factor, which is basically blending the phone with a tablet. Better for reading, texting, etc. 6"" tall, by 4"" wide, makes it about 7.25"" diagonally. Call it the Pixel 10 Wide. 👍 A bezelless. mini iPad Mini that includes an iPhone. No ""foldables"" for me.",display,Subjective,display and user interface,absa,N/A,,positive,0.7502,positive,0.6354,positive,0.8049,True,positive,0.7502,positive,0.6354,positive,0.8049
"Well, I didn't wait, I got the Fold 7. And in my opinion, it has been a very wonderful experience. The phone offers me. Everything I want and love from a foldable. And the thin form factor which makes it thinner than the new folding pixel. It made me take the decision. And the biggest factor that kept me on the foldables, samsung makes would be the bezel on the inner screen It's tiny perfectly reduced and not big and prominent nor shiny, like the one google makes, which in turn you end up with a bezel that has a lot of markings.And scratches for no reason",display,Subjective,display and user interface,absa,N/A,,positive,0.895,positive,0.8896,positive,0.7952,True,positive,0.895,positive,0.8896,positive,0.7952
"I mean if you’re cloud gaming then the processor isn’t really an issue. The Pixel 10 Pro XL has a much larger screen than the S25 though, so I think the gaming experience would likely be better because of that!",performance,Subjective,performance and speed,absa,N/A,,neutral,0.5299,neutral,0.654,neutral,0.6063,True,neutral,0.5299,neutral,0.654,neutral,0.6063
The problem with the Pixel 10 phones from what I've seen is that the processor is very underpowered compared to phones with Snapdragon chips. The gaming performance is woeful and the phones overheat a lot.,performance,Subjective,performance and speed,absa,N/A,,negative,0.9213,negative,0.9017,negative,0.976,True,negative,0.9213,negative,0.9017,negative,0.976
My Pixel 10 Pro XL is randomly restarting by itself and the performance is not as good as my Pixel 9 Pro XL at this stage :(,performance,Subjective,performance and speed,absa,N/A,,negative,0.9534,negative,0.8978,negative,0.5092,True,negative,0.9534,negative,0.8978,negative,0.5092
"​@ashtonbarnes2053not gonna lie, I went and got a pixel 10 pro xl because my carrier gave me a good deal on one, and I must admit, what you saying is definitely true, I barely got signal on my iPhone 13 pro max but with this pixel I have full bars it crazy, now do I feel the phone is better than my apple as far as over all na, my iPhone just feels so much smoother and flows a lot better, but there are some things the pixel does better than the iPhone, like what you stated above, so my apologies fam.",price,Subjective,price and value,absa,N/A,,positive,0.8478,positive,0.7995,neutral,0.6544,False,positive,0.8478,positive,0.7995,neutral,0.6544
"I love pixels, but the 10 is seriously overpriced and outpaced by other phones in this category! The base pixel 10 kind of reminds me of a Samsung A56",price,Subjective,price and value,absa,N/A,,negative,0.7972,negative,0.8112,positive,0.8876,False,negative,0.7972,negative,0.8112,positive,0.8876
"Really good analysis and I basically agree with everything you’ve said there! The iPhone 17 is just better value this year, and it’s a really solid phone. It’s my current daily driver now I’ve reviewed the Pixel 10 and I’m enjoying using it!",price,Subjective,price and value,absa,N/A,,positive,0.9518,positive,0.9447,positive,0.8287,True,positive,0.9518,positive,0.9447,positive,0.8287
"even the s25 is a better deal than pixel 10, which is not as good of a deal as iphone 17. sorry google, but you didn’t actually do anything this year.",price,Subjective,price and value,absa,N/A,,negative,0.5903,neutral,0.4678,neutral,0.9407,True,negative,0.5903,neutral,0.4678,neutral,0.9407
Got a pixel 10 256 GB for $549 as a Google Fi customer. I think for that price the phone is a steal. Great phone. Btw I am a long time iphone user and I love the pixel 10. I think the iphone is boring now.,price,Subjective,price and value,absa,N/A,,positive,0.9595,positive,0.9538,positive,0.7378,True,positive,0.9595,positive,0.9538,positive,0.7378
Pixel 10 is litreally a flop...how can someone with in their right mind pay same price for the phone that works 2x worse than any other competitor in same segment? for that same damn price you can get the s25 ultra or iphone17...like are you mad or what?,price,Subjective,price and value,absa,N/A,,negative,0.9736,negative,0.9343,negative,0.9935,True,negative,0.9736,negative,0.9343,negative,0.9935
"Honestly, I admire the Pixel-fans, because personally there is no way that at the price that the Pixel 10 costs (more expensive than the standard S25 and iPhone 17) Google will see the color of my money. On the other hand, at $400 maximum, it can be a pretty good deal. 🚶🏽‍♂️ 🚶🏽‍♂️ 🚶🏽‍♂️",price,Subjective,price and value,absa,N/A,,neutral,0.4647,neutral,0.4368,positive,0.9838,False,neutral,0.4647,neutral,0.4368,positive,0.9838
The hardware on the iPhone 17 kicks the butt of the pixel 10 it's not even close. But I have to say I'm more in the Android camp I like how I enjoyed works better especially the file system and universal back but to each their own but I couldn't recommend the pixel 10 at its price right now it's more like a 500 phone not 800 they're asking,price,Subjective,price and value,absa,N/A,,negative,0.7078,negative,0.6646,negative,0.9902,True,negative,0.7078,negative,0.6646,negative,0.9902
"Pixel-fans say that power is useless, so logically, the $800 Pixel 10 shouldn't even be an option for them when the Pixel 9 Pro is very easily found at $600 🤷🏽‍♂️ For the others, don't waste your money and instead buy OnePlus 13, S25, Oppo Find X8, iPhone 17 / 16 Pro...",price,Subjective,price and value,absa,N/A,,neutral,0.5613,neutral,0.6638,negative,0.5678,False,neutral,0.5613,neutral,0.6638,negative,0.5678
The Pixel 10 is the best phone of this two but yeah the pixel 9 is a better deal right now!,price,Subjective,price and value,absa,N/A,,positive,0.7008,positive,0.8408,positive,0.7664,True,positive,0.7008,positive,0.8408,positive,0.7664
"Which phone do you recommend, if the price for both is almost the same? The basic Pixel 10 or the Pixel 9 Pro 🤔?",price,Subjective,price and value,absa,N/A,,neutral,0.5977,neutral,0.6709,neutral,0.9794,True,neutral,0.5977,neutral,0.6709,neutral,0.9794
I can see why you'd feel that way. When I made my phone award of 2025. Pixel 10 was the most disappointing phone of the year,price,Subjective,price and value,absa,N/A,,negative,0.7898,negative,0.702,negative,0.9852,True,negative,0.7898,negative,0.702,negative,0.9852
"Price. Solid state battery tech is still too new to be mass market ready. Do you want an ""overpriced"" Pixel 10 to cost even more? And do you want to be guinea pig for an unproven technology (at least vs lithium ion)?",price,Subjective,price and value,absa,N/A,,positive,0.8852,positive,0.7791,positive,0.5556,True,positive,0.8852,positive,0.7791,positive,0.5556
"​@neilmcguinness4422 I had the pixel 6 before I traded it in for my pixel 10 Pro XL, and even though the chip in that phone was 4 years old, it was still performing just as good as new. The key is that Google is really good at optimizing their software for the hardware it's running on. Sorry to burst your bubble, but the pixel 10 being the first phone on the planet that can record in dcg 12-bit RAW is actually an incredible feature— if you need to go look up what that is, do that and then come back 😎",software,Subjective,software,absa,N/A,,positive,0.9181,positive,0.891,positive,0.7542,True,positive,0.9181,positive,0.891,positive,0.7542
"I had hoped for more from the Pixel 10 as I am on a Pixel 7 and held off from the 9-series. I really like Googles take on android, software and the small smart touches such as call screening, rules etc. But I would really like to feel like more convinced that the Pixel 10 is an upgrade because of the progress in hardware and battery, rather than a downgrade in certain areas and that I am not just tempted to purchase because my Pixel 7 has degraded.",software,Subjective,software,absa,N/A,,negative,0.8338,negative,0.6992,negative,0.7394,True,negative,0.8338,negative,0.6992,negative,0.7394
Yes it is but still i guess i will choose pixel 10 pro instead 17.. 10 pro 256gb 911eur and 17 989 eur i had iphone and i know software using and AI and not freezing or too múch bugs and looking like shit Vista Google is better ​@Tiktokpixel,software,Subjective,software,absa,N/A,,neutral,0.6275,neutral,0.6902,negative,0.7513,False,neutral,0.6275,neutral,0.6902,negative,0.7513
